sale , holaaa alguien en mendoza q vaya para el lado de cordoba buenos aires? estoy viajando sola, ando en santigo de chile ya volviendo a la argentina! saludos
sale , Hola alguien viaja mañana viernes desde bs as a Tandil ?
sale , Hola! Voy para la costa #pinamar #valeriadelmar #villagesell en auto. Salgo a eso del mediodia del dia jueves desde zona oeste, General Rodríguez, Buenos Aires. Gracias x su atención!! Buenas rutas!!
busco , Nos vemos el sábado 10 am #Parque Sarmiento! #alagorra
sale , Busco un auto a SAn Marcos SIerras, Cordoba. • Comparto gastos • Cebo mates • Manejo, tengo licencia En San Marcos podemos parar en un hostel por 100 pesos por noche. Quien se prende con el auto? • Estoy en Capital buenos aires. Es para regresar domingo noche o lunes. Viajo con un perrito pinscher de tres kilos mini.
sale , SALE VIAJE DE #LAPLATA Y #BUENOSAIRES A #CORDOBA Y #CERROCOLORADO .....QUIEN SE PRENDE?
sale , #gratisviajes#alguien q quiera biajar para bs as abisen boy para alla salgo de santiago del estero esta noche gracias.....
sale , SE LLENÓ EL VEHICULO (si se baja alguien aviso) Voy para la costa, #MardelPlata , en auto. Salgo a las 14.30hs del dia jueves 13 desde #CABA.
sale , #saleeviaje desde buenos aires #zonaoeste con #destino #neuquen 3 lugares disponibles gastos a compartir #viernes28 por la tarde
sale , Buenos dias gente!! En estos momentos estoy en Santiago de chile y estoy buscando un viaje hacia viña del mar o Valparaiso... se comparten gastos. Abrazooooooo
busco , HOLA GENTE! ESTOY BUSCANDO VIAJE DE BUENOS AIRES-IGUAZU. SE COMPARTE GASTOS. DISPONOBILIDAD CON LA FECHA.
busco , Hola! Busco viaje desde #laplata o #bsas hacia #Azul o alrededores y quiera compartir gastos? Saludos! Puede ser hoy o mañana.
sale , Buscamos viaje de La Plata a Santa Teresita para hoy ya jueves después del mediodía. Nos sirve gente que vaya a Pinamar y alrededores que nos bajamos en Conesa. Somos dos, pagamos peajes, cenamos mates y llevo torta. Gracias :)
busco , Reiteramos... :D
busco , Viajo a Gualeguaychú desde CABA todos los viernes. Vuelvo los Domingos
sale , Hola a todos, LOS MEJORES TIPS VIAJEROS para Semana santa o en sus proximas vacaciones. Espero sea de mucha ayuda. Profesion Viajera
sale , Hola chicos yo y mi amiga queremos viajar desde #cordobacapital mañana 13 de abril a #SanMarcosierra , #gralBelgrano o #villagralPaz es lo que nos recomendaron, si alguien va para esos lugares o recomienda otro estaré atento, compartimos gastos de traslado, llevamos mate y tenemos charlas de aventuras por el mundo para hacer el viaje entretenido saludos!
busco , Ey Gabi Spinelli gracias por aceptarme!
sale , Alguien nos puede acercar a Embalse? O Río Tercero? O traernos de vuelta?!?!?!?! Compartimos gastos! GRACIAS!!!
sale , Buen dia!! Busco viaje que salga de #buenosaires a #sanbernardo o #mardeajo somos dos mujeres! Desde mañana viernes hasta el martes! Graciasss
busco , HOLA GENTE! ESTOY BUSCANDO VIAJE DE BUENOS AIRES-IGUAZU. SE COMPARTE GASTOS. DISPONOBILIDAD CON LA FECHA.
sale , #OFREZCO viaje a #PUNTAALTA #BAHIABLANCA desde #LAPLATA #BSAS el día #DOMINGO16ABRIL horario de salida aprox 20hs. Cualquier consulta mensaje privado o whatsapp sms al 2236344842.
busco , hola quien va a santafe necesito viajar soy de cipolletti manden msjs privado
busco , #salimos viernes 14 temprano #laplata a #marchiquita
busco , #gratisbiajes#algien q quiera biajar para bsas o santiago del estero abisen salgo de salta....
sale , Hola viajeros! Alguien que se vaya para el sur en estás semanas? San Martín en lo posible o zonas cercanas ????????❤ Con Nadia Piechestein queremos viajarrrrr (una o las dos Nos viene bien jaja ) compartimos gastos y risas :)
busco , Hola! Algune que vaya para Córdoba este finde largo? Ofrezco musiquita instrumental para el camino si se quiere, pastas de legumbres y demases cosas ricas.
sale , Alguien salga mañana temprano para sierra de la ventana comparto gas tos
busco , Holaaa, alguno viaja mañana desde bs as a rosario? No tengo problema con la hora!
sale , Tenemos 10 cupos para que puedas vivir tu experiencia de voluntariado internacional de 6 semanas este invierno. Desarrolla tus habilidades de emprendedurismo, sensibilidad cultural y responsabilidad social trabajando en un proyecto en una ONG. Además contribuí con los 17 Objetivos de Desarrollo Sostenible impulsados por la ONU. Agenda una entrevista para que te contemos más sobre el programa y para que puedas sacarte todas las dudas en: https://podio.com/webforms/15417841/1047073
sale , Se ofrecen dos lugares CABA -> MDQ, gastos compartidos, poco equipaje. Salimos esta tarde noche (después de las 18, a confirmar).
sale , Alguien viaja desde Calafate a Punta Arenas en estos dias? (Comparto gastos)
sale , #gratisviajes#algien q quiera ir para bsas desde salta lo llebo salgo mañan paso x santiago del estero....
sale , Alguien que salga mañana jueves desde pergamino a Rosario???
busco , Alguien que viaje a Medellín- Colombia, desde Bucaramanga en estos días?
sale , MY WAY TO FLORIAN, THE HIDDEN JEWEL IN COLOMBIA/ EL CAMINO A FLORIAN…(II) Getting to Florian is not easy, but possible. It is a mining and water zone region, unpaved roads and stretches of waterway, an adventure. But it has its reward ... LLegar a Florian no es facil, pero si posible. Es una region minera y zona hidrica, carreteras sin asfaltar y tramos de via fluviales, toda una aventura. Pero tiene su recompensa... From Antonio bogota get public transport to main station. From there get a bus to Puente nacional and from this town get local bus to Florian (recommend to go early in the morning) or I can take you….
sale , Buenas! soy de Santa Teresita y estudio en La Plata, alguien va para la costa mañana jueves a partir del mediodía? quisiera ir a mis pagos para Semana Santa... Somos dos, pagamos los peajes, cebamos mates y llevaremos torta! Gracias :)
sale , Hola somos UNA PAREJA joven y saldremos de Florida Uruguay a Argentina en Turismo. Buscamos un viaje a Entre Ríos o Rosario o Posadas o algun lugar similar para el domingo 9 o lunes 10 o martes 11. Queremos salir de nuestro pais y conocer un pais hermano. Si algun viajero que vaya de Uruguay o de Argentina tiene lugar y coincide que vaya para uno de estos lugares me lo hace saber y coordinamos para encontrarnos en algún punto del recorrido. Somos simples y sinceros y nos gusta charlar mucho. Desde ya les agradecemos, he visto mucha solidaridad y compañerismo en este grupo, por eso nos unimos hace poco. A todos muchos Saludos y suerte en la ruta.
sale , gengi! alguien va desde #Montevideo a #Baires x semana santa? solo un lugar (!) se comparten gastos
sale , Hola ! Alguien que viaje desde rosario a cba mañana jueves !! O pase por autopista !! Yo solo yo , ni mochi llevo !! Comparto gastos !! ????
busco , Hola ! :) Este finde sucede el encuentro de mujeres candomberas en Concordia. Vivo en Buenos Aires. Alguien que viaje para esos lados? Comparto gastos. :)
sale , Buenas ! gente ... ando precisando devolver una bolsa de dormir hace muchísimo tiempo (años). El destino de su suerte es Río Cuarto, Córdoba y ahora se encuentra en BsAs.... Alguien que vaya para esos lados en estos días o cuando sea? Hay una dueña que la necesita hace tiempo, tiene valor sentimental. PD: Es solo una BOLSA DE DORMIR, NO contiene nada peligroso ni de qué preocuparse ! NO secuencien porque no contiene droga ni nada jajaj Buen viaje para TODXS ! !!! !
busco , Alguien va a Bahía Blanca desde Buenos Aires este fin de semana ? Gracias !!)
busco , alguien sale de capital federal o de GRAN BUENOS AIRES a CORDOBA_______ LLEVO SONRISASS
sale , Buenas! Tengo 1 lugar para ir a #Olavarría #hoy a las #17hs! Desde #capfed. (Poco o nulo equipaje) La idea es compartir gastos! Cualquier cosa me hablan x Mp
sale , Alguien que vaya para Cordoba el Miercoles dsp de las 18? Somos 2. Compartimos gastos :)
busco , gracias grativiajes! rumbo a cordoba!!
busco , Alguien Buenos Aires Cordoba ???
sale , Ojalá este post sirva para inspirar a potenciales viajeros. Van a ver que viajando nos animamos a mucho más de lo que hubiéramos imaginado! Hace más de un año que estamos en la ruta y siempre tuvimos algo con que seguir avanzando (y eso que nos robaron dos veces). Animense, que viajando todo fluye!
busco , hola alguien va a santafe necesito viajar
busco , hola alguien va a santafe nesecito viajar
sale , Buen día! Alguien que viaje para Neco hoy, mañana o el finde? :) Comparto gastos, doy charla y cebo altos mates!! (También se guardar silencio si les gusta viajar silenciosxs) :D Gracias!!!
sale , ConociendoPeru estuvo en Lunahuana junto a otros medios de prensa de turismo especializado y pudimos comprobar que tanto las vías de acceso como los servicios están 100% OK con un sol radiante para disfrutar al máximo aquí les dejamos un videito. Lunahuana los espera!!! #ElTurismoAyuda https://www.facebook.com/conociendoperu/videos/1375078109253181/
busco ,  puedo evitarlo! Pocas veces he pegado viaje por este medio... pero voy a seguir intentando voy a mi primer salida con la escuela de guias de montaña con todas las pilas! Muchas gracias, cualquier dato bienvenido, buenas rutas para todos :)
sale , Holaaaaa, alguien yendo para Uruguay hoy o mañana??
sale , Hola amigo, soy de Brasil y estoy viajando a dedo por Argentina junto a mi amigo Felipe Götz. Ahora estoy en Buenos Aires (cerca de la avenida de mayo) y necesito llegar a Bahia Blanca en el fin de semana. Podemos nos mover hacia donde encuentrar quien haga la ruta! Ya estamos listos. :) Muchissimas gracias!
sale , Hola!! Alguien sabe de algún hospedaje en Paysandú - Uruguay? Para este fin de semana. Gracias!!
busco , Hola! Busco viaje desde la plata o caba hacia mardel para este jueves 13 al mediodia. Somos dos y compartimos gastos. Gracias!!
sale , Hola a todxs! Yo viajo el viernes 14 a la mañana o bien sábado tempranisimo desde San Marcos, Córdoba, a bs As. Voy en camioneta, tengo 2 lugares, comparto gastos.
busco , Que tal gente? Estoy queriendo ir a Parana el jueves. Destinos como Rosario o Santa Fe vienen perfecto también. Si alguien va busco auto para ir. Saludos a todos.
busco , Hola somos dos y queremos ir a Córdoba el jueves pasado el mediodía :)
sale , Estamos en rio colorado. Salimos asia el norte mañana.
sale , Aun sin planes para este fin de semana? Que te parece Lunahuana, a solo dos horas y media de Lima, decidete y visita Lunahuana aqui un video #ElTurismoAyuda
sale , Salida mañana miercoles merlo a villarrica Paraguay por ruta 1 la vuelta el domingo a la tarde! !!!para cualquier información 1158754692
sale , hola alguien viaja al norte??DESDE BUENOS AIRES A corrientes??resistencia o formosa??esta semana?que tenga lugar para llevar a mi amigo y a mi, comparto gastos, saludos!!
sale , Buenas gente! En unas semanas me estoy yendo para Córdoba Capital, de ahí tengo que ir a Jesús María. No logro encontrar información de micros que realicen ese recorrido. Alguno sabe algo? Gracias, saludosss!!
sale , Viajamos a córdoba desde santa fe. Buscamos dos personas, compartimos gasto de nafta. Salida Jueves temprano y regreso domingo a la tarde.
sale , Hola gente como andan? Alguien que valla para Paraguay o misiones Mañana? Gracias y buena vida
sale , Buenas grupooo. Eatoy volviendo de brazil a santa febpor un problema familiar y necesito llegar lo mas rapido posible.y colectivos tengo de tarde noche. EL JUEVES A PRImERA HORA ESTOY PRONTO PARA ARRANCAR DESDE PASOS D los LIBRES, mañana estpy viajando de florianopolis a la frontera llegando laa ultimas horas de mañana o primeras del jueves... asi que si alguno eata en la vuelta se lo voy a agradecer de corazón. Buenos camminos a todos
sale , Gracias gente por la ayuda!! A fin de la semana estaremos viajando con mi Mavari Jazmin Gualicho para Misiones!! Es posible que haya un lugar disponible... Estaré avisando a mitad de semana cualquier cosa! Gracias gracias gracias!!!!
sale , Buenas. Busco viaje de Concordia a CABA, comparto gastos. Gracias.
busco , Hola!! Alguien que este en Jujuy o Salta y viaje para Bs As capital este finde?? Compartimos gastos y unos buenos mates ????
sale , Hola gente, ¿alguien viaja el Martes 25/04/2017 hacia Mar del Plata? Necesito estar a las 8:00 hs
sale , Buenas! Busco viaje #Córdoba hacia #traslasierra. #Villadelasrosas #villadolores #jueves13 por la mañana
busco , Holaaa! Alguien que pase HOY por #SanFrancisco tipo 20hs y vaya hasta #Cordoba? Soy yo, una mochila grande y una perrita que se porta re bien. Gracias!
sale , Hola! Alguien que vaya mañana miercoles a la tarde de Salta capital a Tafi del Valle y que quiera compartir gastos y mates?? :)
sale , Hola amigos estoy saliendo para Mina Clavero ( traslasierra cba) el jueves bien temprano. Me queda 1 lugar de ida y otro de vuelta. AVISEN si alguien quiere viajar con nosotros. Mandar privado.
sale , Hola amigxs! Alguien que vuelva/pase por Rosario el domingo 16 desde San Marcos Sierra o alrededores? No hay problema la distancia, nos movemos hasta donde sea necesario. Somos dos. Gracias!!! Buen finde largo para todxs
sale , Hola grupo alguno que este por viajar a villa la angostura desde san martin el dia de mañana.
sale , Buenas tardes gente!! Alguien viaja desde la ciudad de San Luis para Buenos Aires Capital? (Jueves, viernes?)
sale , Hola amigos llegamos a Itati corrientes. Estamos buscando alguien buena onda que nos pueda dar agua. Llegamos con el tanque vacío y con este calor vamos a necesitar una ducha. Les dejo mi número para Whatsapp +5491167745677 sino por privado Muchas gracias a todos
sale , Hola genteeee! Alguien q salga de rosario hasta Mardel el miércoles a la noche??? Y tenga ganas de llevarme a mi y una amiga?! Millón de gracias!!!
sale , Hola!! Somos dos y vamos desde MdP a Córdoba. Queremos salir del 19 al 24 de abril . Si alguien sale para esos lados y puede siquiera acercarnos seria un golazo. Compartimos gastos
sale , Buenas viajeros! Con mi compa queremos viajar a la costa el jueves ( si van a Mar de las pampas/ Villa Gesell mejor) compartimos gastos y mate!!
sale , Buen día! Alguien que viaje desde CABA a Mardel: mañana Miercoles 12 despues de las 15 ó Jueves 13?? Comparto gastos , cebo mate y llevo buena onda!!????????Saludoos y Gracias!!
busco , Buenas tardes necesito viajar a pergamino tipo el jueves..
busco , Hola! Alguien tiene idea de micros alternativos ( particulares/más económicos) que vayan a Córdoba desde retiro?
busco , Holas! Alguien sale para Rosario desde CABA en semana santa? (jueves, viernes..)
busco , #buecoviaje a #paraguay para semana santa, alguien va para alla? o se acerca?? comparto gastos!
sale , Hola. Alguien que vaya a córdoba del 17 al 20 de abril ?? Compartimos gastos. Somos dos
busco , Buenas gente! Estoy buscando viaje mendoza cordoba para este finde, puede ser saliendo miercoles jueves o viernes, comparto gastos, somos 2. Salutee
busco , Hola, I will be travelling to the south of Spain next month and I am looking for the best way to travel from Cadiz to Gibraltar by bus or public transportation, do you have any suggestions?
sale , Holas¡! Nos queda un lugar para el miercoles al mediodía rumbo a #Uruguay #OceanPark desde #Buenosaires. Compartimos gastos. ????????
busco , Hola gente # buscoviaje para el miércoles o jueves de #bariloche hacia el norte por la ruta 40 destino #zapala.
busco , ALGUIEN VA DESDE SAN JUAN A CORDOBA? ESTE JUEVES?
sale , Buenas gente linda!! Salimos mañana a la mañana tempranito hacia Posadas desde la Matanza, Bs As. Si hay algúnx interesadx avise, hay 3 lugares????
sale , BUENAS!!!! Viajo el Domingo 16 primera hora de la mañana a Cipolletti y el 18 viajo a el Calafate!... voy cargada de cosas y sola en la ruta, hay un lugar para compartir mates, manejo, ruta....besotes #buenosaires #cipolletti #neuquen #elcalafate
busco , Sale #la plata - #mar.chiquita - Viernes 14
sale , ¡Hola! ¿Alguien sale hoy o mañana desde Bs As a Tandil o cercanias? Somos dos, compartimos gastos y yo hago unos mates muy ricos! ¡Gracias! ????✌
sale , Buen dia... Soy de Brasil estoy viajando hasta ushuaya en mi skate longboard...pero ahora preciso ir hasta #rosario e estoy en #buenosaires... Soy artesano e puedo conpartir algo por el dedo hasta ahi Gracias
sale , Buen dia gente linda! Estoy saliendo a dedo este lunes 17/04 desde la ciudad de Loberia, a 50km de Necochea por la ruta 227 con destino Mercedes, Bs.As. Si hay algún camionero que pase por acá y puede, avisen. Estoy saliendo de mochila,una vez mas rumbo Centro América, sin prisa y sin tiempo. PD: llevo mate y la mejor predisposición para lo que sea. MUCHAS GRACIAS!!!!!! Que tengan todos,un gran día.
sale , Buenas, alguien viaja desde Buenos Aires para el lado de Misiones, puede ser Concordia, Curuzú Cuatia o Paso de lo Libres Mañana 12/04 pasada las 15:00 hs.? Solo ida. La vuelta ya esta arreglada. Saludos, se comparten gastos
sale , Hola viajamos el jueves desde mendoza a San Juan, mi niño y yo.... Alguien que vaya en vehículo para compartir los gastos???
sale , Buenas, alguien arranca para san clemente mañana a la noche o el jueves a la mañana??
sale , Holaa.. Alguien pasando por la serranita, que valla o pase por los reartes? Pasamos la noche con mi compa y mi perra en la garita de la entrada de la rancherita y la serranita.. la verda estaria demas llegar (: buenas rutas!
sale , Buen dia gente, alguien de bahía blanca que se dirija hacia santa rosa o cordoba? Voy a estar dedeando sobre ruta 35, cualquier aventon viene bien. Soy yo y mi mochila, puedo compartir gastos.
sale , Marcial. iguales a la gente q vaya. Los gastos son 1600 aprox nafta y 200 peajes. No me pregunten cuanto es, diganme si pueden aportar, cuanto o sino. Me ponen en una situación incomoda ya en regatear los gastos. Gastos son gastos. Saludos.
busco , alguien?
sale , Alguien que viaje para el lado de junin, jueves a la noche o viernes... Comparto gastos!
sale , https://www.facebook.com/enesteviaje/
sale , Buenas noches tormentosaa!! Hay dos lugares para ir a Córdoba desde bs as. Avisen los primeros los sumamos! Salimos el jueves a la madrugada y volvemos el domingo a la tarde
sale , Hola! alguien viaja el finde largo desde La Plata a Tandil con 3 lugares disponibles a compartir gastos? Gracias!!!
sale , Buenas buenas ! Me encuentro en Esquel estoy bajando por la ruta 40 mañana sigo camino! Alguien que ande cerca ?
sale , Hola amigos viajeros!! Necesito viajar el jueves desde gral roca a Bariloche, me puedo acercar hasta neuquen o cipoletti. Colaboro con los gastos. Gracias!!!
sale , Hola compas viajeros! Alguien que viaje de Bs As- Córdoba el miércoles o jueves? Sale compartir gastos :)
sale , Hola gente!!! Alguien que viaje desde San luis a san Rafael ,monte coman o general alvear? Miércoles por la tarde o jueves a la mañana? Agradezco cualquier cosa...saludos y buena semana!!!
sale , REIR ES VIVIR EN SERIO CONQUISTANDO EL MUNDO DE LAS EMOCIONES POSITIVAS. SON GENERADORAS DEL PODER DE SER NOSOTROS MISMOS. ¡¡¡Y NOS MUEVE A SER AUTENTICOS!!!
sale , NO TE PIERDAS NUESTRAS TARIFAS PROMOCIONALES PARA SEMANA SANTA !!!! CONSULTANOS AL 0266 15 4876037 (RECIBIMOS WTSP)
busco , NO TENES TIEMPO PARA PASEAR A TU PERRO? YO SI!
busco , desde San Luis Capital a Machu Picchu..26 días de viaje..de mochila..increíble experiencia de la vida..es cuestion de actitud
sale , buenas tardes viajeroooooooooos!!! Alguien que salga desde bs as capital a cordoba en semana santaaaa y tenga un lugaaaar!!?!?? Saludos y siempre graciassss !!!!
sale , Buenas! por aquí de nuevo, me está quedando un lugar para el Uru #Uruguay desde Buenos Aires el miercoles 12 mediodía es lo más probable!, estando ya ahí, el viernes seguiríamos para Cabo Polonio desde Playa Verde. Domingo pegaríamos la Vuelta a Bs As. Compartimos gastos, poco equipaje. Saludos!
busco , ¿Alguien se va a Uruguay esta semana?
sale , Buenas tardes gente! Necesito viajar de #CABA a #SanLuis el #13/4, alguien sabe de algo? Sino la vuelta de #SanLuis para #CABA el domingo, para laburar temprano el lunes. Gracias de antemano
sale , Alguien de salta a Córdoba estoy en la ruta
sale , Bienas tardes genchi!! Necesitaria viajar el miercols de bolson a bariloche...x la mañana si alguien tiene un lugarcito! Voy sevando ricos matecitos! Gracias
sale , Gracias a los que me ayudaron a llegar desde Neuquén a Córdoba y desde Córdoba a San Luis.
sale , Hola viajeros!! Alguien sabe como están las rutas (condiciones y si hay inundaciones o algún problema) para ir de Buenos Aires a Neuquén por Casa de Piedra o Conquista del Desierto? Alguien paso/vive por ahí en estos días? Agradezco la info. Saludosssss
busco , Hola buenas tardes!!! Alguien que vaya para cordoba, capilla del monte este finde largo???? Desde rosario , sta fe
busco , Hola grupo estoy saliendo de Brasil así a Argentina
busco , Hola! Busco viaje para volver de traslasierra cordoba el domingo! Hasta BS. AS. GRACIASSSS
sale , holaa busco un cupo para bs as - mardel para el miercoles!!! porfa si alguien tiene cupo aviseme! gracias!!
sale , Revive con nosotros una de las experiencias más fuertes de nuestro viaje. Animales nocturnos, chamanes, rituales ancestrales y el primer acercamiento a la Ayahuasca. Adentrate en uno de los lugares más mágicos del mundo: la selva.
sale , Hola gente linda!!! Este miercoles o jueves alguien q vaya para Saladillo o para Las Flores y me pueda llevar? Comparto gastos.. Muchas gracias
busco , Alguien que valla hasta bs as o mardel desde tucuman?
busco , Hola! Como va eso? Che quiero preguntar por el estado de la ruta 40 y sus pueblos alrededores si esta todo bien transitable, con todos los destrozos que estan sucediendo del lado costero de nuestro pais. Voy rumbo a ushuaia.
busco , .
sale , Buenas! Busco viaje. Origen: Mendoza. Destino: San Luis. Dia: entre el 18 y 20 de abril. Pasajeros: 2, Agustina y Juan. Compartimos gastos, somos puntuales y respetuosos. Si algunos hace este tramo y tiene lugar ????. Se agradece info. Buenas rutas!
sale ,  #comodororivadavia a #bsas...... por favor si pueden colaborar es para Leo Voznankoch que se encuentra aca en comodoro ayudando a las familias que perdieron todo y ahora su familia se encuentra asi y necesita viajar . gracias difundir saludos
busco ,  Busco viaje para éste finde de pascuas ( jueves,viernes o sábado) a Cordoba capital desde La Pampa, General Pico o cercanías... Cualquier data se agradece! Gracias por su atención ????
busco , Hola, alguno que viaje hoy o mañana desde capital hasta mar del plata?
busco , Hola!!! Alguno/a que vaya a Bs.As desde Bariloche para semana santa? Comparto gastos!
sale , Hola amigos! Alguien de la comunidad que vaya desde Villa María a Villa General Belgrano en estos dias?
busco , Hola. Quiero ir a Córdoba el jueves 13. Alguien va? Soy yo sola y comparto gastos.
busco , Hola gente!! Alguien sale par Córdoba desde buenos aires entre el lunes y martes? Seria genial si pueden agregar a su viaje a este negrito q les puede cebar mates i o u servir la birra jaja ????
sale , MUCHAS GRACIAS!!! Queremos agradecer a TODA la gente que se sumó a nuestra propuesta y se comprometió juntando y trayendo sus donaciones para el Hogar Jesus de Nazareth! La verdad es que no pensamos que íbamos a juntar tal cantidad de cosas, y quedamos gratamente Sorprendidos! Fuimos a Hacer la entrega el día Sábado 8/4, Apenas llegamos, algunos de los chicos corrieron a recibirnos al auto, y todos querían ayudarnos a bajar las bolsas! No les importaba que era... ellos querían ayudar! Conocimos Sergio y su mujer, quienes están a cargo del lugar, y un montón de gente que los ayuda. Nos sorprendió lo responsables que se veían los chicos, sobre todo los mas grandes, que la mayoría estaba haciendo algo o cuidando a algún bebe. Fue una experiencia Hermosa! Les agradecemos a TODOS los que pudieron colaborar!!! Esto no se termina acá!!! en breve vamos a volver a organizarnos para llevar mas ayuda a otro lugar que la necesite!!!
sale , Busco viaje de #Bariloche a #Mendoza (o arenales) el 12 a la tarde o 13 a la mañana. Cebo mates y comparto música (y gastos) .:)
sale , ALGUIEN SALE DESDE URUGUAY O DESDE BS AS HACIA LA CONVE DE PARAGUAY O POR LA 14 HACIA EL NORTE? COMPARTO GASTOS Y MATES!
sale , alguien va para la conve de paraguay desde buenos aires? comparto gastos
sale , Buen día ! Alguien que viaje desde Bolsón a Bariloche el miércoles? Gracias !
sale , Hola, salgo de mdp a caba el miércoles 12 a la mañana tipo 8hs. Hay 2 lugares
sale , Buenas! Alguien que viaje de #Bariloche a #Chile ojalá #concepción para semana santa? Viajo con mi perrita, se porta muy bien y es limpia. Saludos :)
sale , Viajo a capital en auto, desde villa ramallo salgo hoy 16 30, de san nicolas salgo a las 13 hasta villa ramallo, tengo 2 lugares en el auto salud!
busco , !!!
busco , A Trilha Salkantay está entre as 25 melhores trilhas do mundo, de acordo com a revista National Geographic Adventure Travel.►
busco , ????️????????
sale ,  Laguna Esmeralda -Ushuaia http://elmoondoatuspies.blogspot.com.ar/2017/04/diariodeviaje-laguna-esmeralda-ushuaia.html El trekking a Laguna Esmeralda es uno de los más atractivos. La belleza paisajística, el recorrido por el bosque y los turbales, ofrecen una experiencia hermosa y memorable. La caminata dura unas tres horas de ida y vuelta, aunque se puede prolongar hacia el Glaciar Ojo del Albino. #LagunaEsmeralda #Ushuaia #TierradelFuego #Trekking Alguna vez visitaste la Laguna, comentá tu experiencia. El Moon do a tus pies, blog de viajes, relatos de experiencias. Un proyecto chiquito, una gran pasión. Sumá tu like, seguí sus actualizaciones, compartí... https://www.facebook.com/elmoondoatuspies/ Seguí @elmoondoatuspie
sale , Hola! ! alguien viaja de Buenos Aires a Mendoza en estos dias y le sobran dos lugares? Gastos compartidos!
