sale , Parada de Crucero!!! ⚓ Civitavecchia !!! Si no queréis hacer la típica excursión ???? a Roma. Aquí os dejamos que hacer es esta preciosa parada sin gastar un dineral!!!????
sale , Hola busco viajar de #Rosario a #Cordoba el día 12/4 ofrezco compartir gastos de combustibles, mates y charla... Gracias!
sale , ¡Hola gente bella! ¿Alguien que viaje hoy (09/04) de Bolsón,o alrededores patagónicos, a Bariloche? Necesito estar mañana a las 08:00 hs am en una clase importante. Y me quedé sin pasajes. Comparto mates, charlas o soy calladito si hace falta, ¡jua!. Gracias, abrazos.
sale , Buen dia ????! Necesito llegar desde la plata a buenos aires este lunes tipo 8 am, o en su defecto hoy a la noche, para enganchar otro vuaje. Voy con mi perrita! Pago la nafta!!! Si alguien sabe o puede... chiflen. Gracias
sale , Gente, busco viajar de Córdoba a concordia en semana santa. Si alguien va, chiflen. Abrazo
sale , Buenas! Busco viaje. Origen: Mendoza. Destino: San Luis. Dia: 18/4 (en lo posible en la mañana). Pasajeros: 2, Agustina y Juan. Compartimos gastos, somos puntuales y respetuosos. Si algunos hace este tramo y tiene lugar ????. Se agradece info. Buenas rutas!
sale , Hola necesito información de viaje en tren de BS As a Tucumán o trayecto similar. Alguien sabe valores? Y horario. Gracias. Buenas rutas
busco , Hola amigos Busco viaje de #mendoza a #buenosaires (MDP) somos 2 ! para el jueves 13 Se agradece cualquier info
busco , Hola! Alguien va desde RIO GALLEGOS EN DIRECCION NORTE?? Somos 2 y queremos llegar a Buenos Aires la semana que viene. Quizas alguien nos pueda acercar? Gracias!
sale , Buen día compass! Algúnx va de bs as a Córdoba este miércoles por casualidad, o tienen idea si hay boleto en tren? Graciass salut
busco , Hola chicos quería compartir esta hermosa experiencia por el nido Filipinas
busco , Hola, necessito con una amiga, ir de la Plata a Mar del Plata. Alguien nos puede llevar?
sale , Este genio viajero esta volviendo de Brasil. Viaja con sus dos cachorros. Ahora esta en Colón, Entre Rios y necesita una mano. La combi se le rompió. Y esta muy cerca del río, esta lloviendo y se complica para trabajar. Si alguno anda por ahí y puede darle una mano será bienvenido. Ayudemos a una persona noble y solidaria. Arriba Marian que no decaiga!!!
sale , BUENAS BUENAS SALUDOS VIAJEROS! ESTOY BUSCANDO UN DEDO QUE VAYA DE BUENOS AIRES A ROSARIO, PODEMOS COMPARTIR GASTOS. PUEDE SER CUALQUIERA DE ESTOS DIAS. SE AGRADECERÁ INFINITAMENTE A QUIEN SEPA O SE COPE :) GRACIAS!
sale , Busco auto que viaje de Córdoba a la Rioja ,en lo posible para el miércoles a la noche o jueves . Gracias !
sale , Hola gente que tal? Alguien sabe como se accede a los esteros del Iberá? Si tengo que ir a corrientes capital primero o puedo ir directamente, soy de Tucumán
sale , Gente voy a viajar proximamente a mendoza lugares recomendados para conocer?
sale , Hola gente, alguien conoce hospedaje, hotel, hostel... barato para la semana del 17 en la plata?
sale , Fabuloso viaje de Ida de San Luis a BsAs con Laura y de Vuelta de Junín a San Luis con Tami y Andrea. Mates, charlas, anécdotas, risas. Seguimos sumando kilómetros y nuevos amigos. Gracias Grati.Viajes!!!
sale , Buenas gente linda, somos 2 recién llegados de la Antártida viajando por Cuyo. Planeamos salir el martes desde Malargüe hasta el parque Talampaya pasando por Mendoza y San Juan capitales. Vamos en auto y hay lugar para 2 que se quieran sumar en cualquier parte del tramo. Compartimos gastos e historias a discreción. Avisen nomás
sale , Buenas! Buscamos viajes desde #uruguay a #misiones a mediados de mes, alguna opcion?
sale , Martes 9 hs sale desde Bariloche hasta miramar. Un lugar disponible.
busco , Hola...necesito que me lleven una caja de miel de bolson a buenos aires...hago trueque por miel. Gracias
sale , Hola!! Alguien que vaya de Bs As para Bahia Blanca, miércoles a la tarde- noche o jueves temprano? Gracias!!
sale , Buenos días !! Continuo con mi busqueda de un viaje de Capital a bahia blanca saliendo miercoles a la tardecita/noche o jueves x la mañana. Si es posible ida y vuelta mucho mejor! Soy yo y un violoncello. Compartos gastos, mates e historias de mitología griega
busco , Hola como va? Alguien que vaya desde #BuenosAires hasta #PuertoMadryn? el jueves 20 o viernes 21?
sale , https://www.facebook.com/sanmartingob/photos/a.431616280208051.88029.429052330464446/1303132863056384/?type=3&theater
sale , Alguien que salga de buenos aires a Rosario en semana santa?? ????
busco , Hola buen día, Alguien que vaya a Buenos Aires el domingo 16 o después de semana Santa,desde Mendoza??
sale , Alguno que viaje sabado 15 de abril, a la mañana, para mar del plata? Desde Buenos Aires, Capital.
sale , Olis!! bueco viaje de Buenos aires a Necochea para este martes o miercoles... Gracias!!! =)
sale , Hola! Mi mamá esta varada en Rio gallegos, necesita llegar a Trelew, y la ruta por comodoro esta cerrada. Si alguien va para algún lugar del sur aunque sea un poquito mas cercano a Tw. Se comparten gastos. (No hay micros, y los aviones están colapsados)
sale , Buenas! Busco viajar de Córdoba a Rosario para semana santa. Seriamos mi hijo de 6 años y yo. Comparto gastos. Gracias!
sale , Hola hola estamos con una amiga saliendo d zarate para iguazu .si algien va para ese lado y tiene lugar.se lo agradeceriamos mucho.
busco , ¡Vamos Manaos!
sale , hola familia estoy en misiones en EL DORADO sera que alguien tiene un lugar hasta ENTRE RIOS :D gracias buenas rutas
sale , Buenas estoy buscando viaje a Cordoba para semana santa, si alguien es tan amable de aceptarme de copilota seria genial, hago mates, comparto gastos si es necesario. Gracias, suerte para todos los viajeros.
sale , Buenas, alguien viaja de Cordoba a Salta el miercoles o jueves? Gracias!!
sale , Buenas!! Alguien que vaya a la tierra del sol y del buen VINO en semana santa?? #Mendoza ... Somos dos buscamos viaje!!
sale , En este momento, en Puerto Montt, Chile por comenzar la ruta austral. El camino recorrido y lo que está por venir en: https://www.facebook.com/ElViajedelaAlbahaca/
sale , buenas tardes noches, paso a dejarle data de los micros que salen de Once para el norte, estan cobrando entre $700 y $1200 pesos depende el destino, $1200 La Quiaca (Jujuy) y Tartagal (Salta). Todos los dias menos los domingos salen y tienen 3 horarios a las 12hs 14hs y 16hs y a Tartagal unicamente a las 10hs. Y en liniers tienen en promocion los micros a Santa Cruz de la Sierra, lo tienen en 1500$ Espero les sirva la info, buenas rutas, nos vemos en Bolivia y Peru!!
sale , ¡Gracias por aceptarme en el grupo! Saludos cordiales.
sale , Consulta: Alguien a viajado de Capital a San Rafael, o viceversa, en estos dias, que estado esta la ruta?
busco , Hola!!! Alguien por aqui que viaja de Valparaíso o Santiago a Bariloche tipo 12 de abril :-)?
busco , Buenas!! buscoviaje de La Plata a La Pampa (General Pico o Santa Rosa) para la semana que viene Lunes o Martes!! Si alguien pasa por ahi me avisa. Gracias!!
busco , Holaaa! Alguien sabria decirme que onda con el dedo en Perico?
sale , Holaaa! Una pregunta, había leído una vez acá de una página (tipo groupon, pero otra) que tenía pasajes reee baratos a la costa (en enero salía 200 y algo) pero no me acuerdo cuál era, alguien sabe???
sale , En una hora aproximadamente estaré por chajari, y creo q me quedo en la noche ahí... Y después continuo el viaje rumbo Luján
sale , Buenas noches! Deseo llegar a #Brasil, #Florianopolis. No tengo un día fijo de salida, pero quiero rajar jajaj. Comparto gastos, obvio :) Saludos y gracias de antemano!
busco , Oye! Alguien se va de cordoba a mendialoza lunes porfa? Graciaaaas
sale , Hola viajeros!! Somos tres amigos de BS.AS capital. Con mate y muchas ganas de viajar!! (Compartimos gastos) algún lugar que no tenemos definido aún... para la fecha de semana santa! Por favor chicos si nos pueden ayudar y nos quieran llevar! Se los re agradecemos!! Queremos armar la mochila!! Saludos y buenas rutas a todos! ????✌
busco , Tengo q ir hasta bs as.. alguno q vaya para alla desde ushuaia o q me deje antes no importa despues sigo a dedo
sale , Alguien que viaje a Necochea hoy? Estoy en Tres Arroyos. Hoy el jueves de semana santa si alguno viaja tire la data por favor. Si no me verán haciendo dedo, gracias y buenas vibras para todos!!!!
busco , Hola gente bella!! Ando buscando viaje desde #BuenosAires a #Córdoba. Hago aportes necesarios, llevo café y buena música!!
sale , VENI A PASAR SEMANA SANTA EN SAN LUIS !!! TE ESPERAMOS !!!!!
sale , Buenas! Busco viaje para dos personas, compartimos gastos y somos responsables y puntuales. Salida: Mendoza capital. Destino: San Luis. Dia: 18/4. Si alguien va por este tramo o pasa por ahí y tiene lugar se los agradecería. Cualquier info es bienvenida. Gracias!
sale , Grativiajeros! Con permiso del administrador, les comparto esta publicación. Para los que no lo conocen, les presento House Sitting cuidar la casa y las mascotas de un total desconocido cuando éste se va de vacaciones. Con mi pareja Magali lo venimos haciendo hace varios años y estamos intentando plantar la semilla de este lado del charco para que cada vez haya más oportunidades para todos. En el enlace de abajo encontrarán, por ejemplo, una hermosa casa para cuidar en México. Si quieren conocer la dinámica de este intercambio, los secretos y cómo efectivamente cuidar una casa, los invito a leer el libro que hemos escrito después de más de 25 casas cuidadas: www.laguiadehousesitting.com/explora No los molesto más. Buen Sábado, buenos viajes y buena vida para todos ????????????
sale , Hola!! Algunx con lugar en el auto que viaje de Capital Federal a Junín (BUE) en semana Santa?
sale , Hola gentee cmo vaa necesito qie me ayuden. NECESITO SABER QUE RUTA ESTAN HACIENDO PARA PASAR DE COMODORO HACIA ARRIBA ESTOY EN ELCHALTEN Y NOSE CUAL ES EL DESVIO Q ESTAN HACIENDO.. NEC LLEGAR A TRELEW. PORFA SI ALGUIEN ME PUEDE DAR UNA MANITOOO
sale , Pueblo nómade x excelencia ! Todos los viajeros inveterados tendremos un poco de su ADN?
busco , Buenas buenass, alguien va para #sanrafael para semana santa desde #rosario??
sale , De vacaciones en nuestra maravilla natural de la humanidad!!!
busco , Holaaa!! Alguien va a san luis mañana q pase por cordoba o cerxa ??
busco , De Buenos Aires a Cba? para el miercoles 12? Saludo gente!
busco , Hola a todos! BUSCO viaje Buenos Aires - Bahía Blanca para miercoles 12 preferentemente. Encontrarè?
busco , Buenas! Hoy bahia bs as? Alguien !? Tiro unos pe ???? ????
busco , Hola! alguien va de bahía blanca a Rio colorado hoy?
sale , Alguien q viaje mañana de rosario a la plata?? Compartimos gastos!! Tiene q ser mañana sabado!!
sale , Busco viaje #laplata desde #mardelplata para el dia sabado 8 de abril a primera hora. Gracias gente!!
sale , BUSCO BUSCO. viaje de la costa a LaPlata. Para este miercoles 12.. y de la plata a la costa el domingo 16! Comparto gastos!!
busco , hola mochilas alguien por Colombia con destino a santa marta , Cartagena o Barranquilla .. planeo salir a fin de mes de Medellin .. ahora estoy en Armenia ..BUEN VIAJE !!
sale , Somos Ornella y Diego. Hace mas de un año salimos de la Patagonia Argentina, nuestra casa, con rumbo al mundo. Hemos recorrido más de 14 mil km, haciendo autostop y en bus, hasta llegar a México. Quienes quieran compartir nuestro viaje, los invitamos a seguir nuestra página https://www.facebook.com/ambosmundosblog/ (y de ahí pueden ir a nuestro blog) Cualquiera que esté pensando su viaje por América, no dude en consultarnos lo que sea! Estamos para ayudarnos entre viajeros!
sale , Buenas noches!!! Consulta...vivo en Santa Rosa de Calamuchita y mañana voy a Córdoba en la mañana...alguien va y compartiría un lugar? Compartimos gastos, mates...graciassss
sale , Gente buen dia, alguien p tandil jueves o vuernes santo? Yo en la plata pero muevo x ahi graciasss
busco , Buenas! ! Algún viaje para este finde o en la semana a Merlo, San Luis, Villa Dolores o alrededores?
sale , Buenass!! Busco viaje al sur..puerto madrin..trelew rawson..para semana santa..comparto gastos! :)
busco , Alguien que pase por coronel suarez con destino bs as sabado o domingo? Ayudo con los gastos...
sale , El Machu Picchu es paso obligado para los viajeros que visitamos #Peru. Pero ¿Cual es la mejor opción para llegar?. Les contamos que camino hicimos nosotros, 4 días y 3 noches por el poco tradicional Camino de los Chaskis, una opción diferente para conocer la región. ¿Se puede evitar el costoso tren hasta Aguas Calientes? ¿Como se llega caminando desde Hidroeléctrica? ¿Vale la pena subir hasta el Huayna Picchu? Pasen, denle Play al Audioblog y disfruten las fotos !
busco , Hola viajeros, estuve investigando y creo que a día de hoy la forma más barata y segura de ir a Machu Picchu es esta. Espero que les sirva!!
sale , buenas alguien q salga de bs as a cordoba precisamente capilla del monte ?
sale , Hola a todos!alguuien que salga de Bs.As. a San Martin de Los Andes para el martes 11/4 o miércoles 12/4?Gracias!Salutes! :)
sale , Viajo a Córdoba para semana santa, dispongo de 3 lugares.
busco , Buenas, alguien desde san salvador de jujuy que este bajando para el sur?
sale , Revive con nosotros una de las experiencias más fuertes de nuestro viaje. Animales nocturnos, chamanes, rituales ancestrales y el primer acercamiento a la Ayahuasca. Adentrate en no de los lugares más mágicos del mundo: la selva.
sale , Aviso para los LITORALEÑOS. Estoy por viajar en auto el lunes 10-04 hacia Entre Rios, mas precisamente a Villa Elisa. Partimos desde zona norte, Bs.As. Si llegamos a 4 personas el viaje nos sale muy barato. En el caso de querer viajar comunicarse conmigo por este medio. Volveria el Jueves 13 hacia Bs.As, por si alguien necesita transporte desde alla...
sale , Buenas! Busco viaje de la plata a Tandil el jueves de semana santa en lo posible después de las 17hs, comparto gastos! Saludos
sale , FLORIAN A JEWEL HIDDEN IN COLOMBIA/FLORIAN, UNA JOYA AUN ESCONDIDA (I) Florian, Si quieres aventura, belleza paisajistica extrema, explorar un sitio unico y sentirte protagonista de tu propia experiencia, visita FLORIAN. If you want adventure, extreme scenic beauty, explore a unique place and feel yourself the protagonist of your own experience, visit FLORIAN. Not easy to get there, but posible. From Antonio bogota get public transport to main station. From there get a bus to Puente nacional and from this town get local bus to Florian
busco , Hola gente, alguien arranca para capital, entre hoy y mañana? O va a Armin?. Si alguno puede comparto gastos y buena onda! :)
sale , Parada de Crucero!!! ⚓ Civitavecchia !!! Si no queréis hacer la típica excursión ???? a Roma. Aquí os dejamos que hacer es esta preciosa parada sin gastar un dineral!!!????
sale , Alguien que viaje de Gesell a Capital viernes 9 o sabasdo 10 cebo mate y colaboro con gastos
busco , Hola. Alguien sale con destino costero este finde largo ? Somos dos buscando un aventon !
sale , Un hermano del alma está barado en SANTIAGO DE CHILE. Se llama Fran , está viajando a dedo con su violín. Llego a Santiago y se le rompió una cuerda del violín, salió a tocar y se le cayó el alma. Esta hace días sin poder trabajar. Se que esta en la terminal de Santiago, que esta con hambre y cansado, se quiere pegar una ducha y dejar las mochilas un ratito. Es difícil comunicarse con el porqué no tiene datos, ni plata para internet. Si alguna de ustedes que esté por ahí puede acercarse a darle aunque sea un abrazo , se los agradezco de corazón. Fran es un amor ???? Gracias!!!!
sale , Buenas! Alguien que viaje a Junin de los andes, San Martin de los andes o cerca? En algún momento dentro de estos tres meses q corren?
sale , desde Luján, Capital Federal, zonas aledañas, salgo para donde pinte con quien pinte en semana santa. Compartiendo gastos obbbbbbbbbbbbbbbbvio. Cebo mate amargo, canto bien, y te hago cagar de risa (eso dicen)
sale , Hola estoy saliendo el 13 a la tarde para Bahía Blanca y voy solo ,si alguien necesita viajar me avisa,salgo de la Plata!
sale , Mi amiga viajar a Bolivia lo más pronto posible, solo una persona con poco equipaje. Lo más cerca que puedan de la frontera con Bolivia también ayuda! Gracias!
sale , Hola gente! Alguien viaja desde Olavarría a Tandil hoy? Comparto gastos! Gracias.
busco , Hola!! Alguien sale a #brasil?? Desde #buenosaires!! Comparto gastos si es necesario, aunque no tengo mucha plata. Y si alguien me acompaña haciendo dedo, mucho mejor!!! Hoy, hoy, oí!
busco , Buenas chico! Somos dos y buscamos viaje de misiones (y rededores) a Córdoba para semana santa. No tenemos mucha plata para colaborar pero Tenemos muy buena charla y cebamos mates riquísimos ????
sale , BUSCO viaje desde tandil para olavarria para hoy a la noche y mañana sabado!
sale , Buen día colegas viajeros! Les cuento que estoy en Córdoba Capital y estoy pensando en hacer ruta a capital federal, quería preguntarles cuál es el medio más económico para llegar a allá, qué tal funciona el dedo, carona, aventon, jalada aquí en Argentina y lo otro si alguien quiere llevarme ayudo a compartir gastos!
sale , Hola a todos! Paso a contarles lo que me sucedió, ya que amerita. Ofreciendo un viaje de Villa María a Buenos, Aires, me escribe Maximus Magnonimus para unirse. Le digo que, compartiendo gastos, sería un viaje de $300. Horas antes de viajar, me escribe contándome que le robaron casi toda su plata de su riñonera en un bar, que si podía viajar pero me pagaba en Baires si o si. Yo no lo conocía pero me dije: a cualquiera le puede pasar, que bajón! ayudémoslo! Le dije que todo bien, que hagamos eso de una! Durante el viaje me dió $100 y me reiteró que en Baires me alcanzaba el resto. El viaje fue muy lindo, compartimos todos. Ya en Baires, tratamos de coordinar varias veces pero se le iba complicando para acercarme la plata (eso me dijo). Los ultimos mensajes míos, ya directamente los mira pero no me responde o sea que desapareció :( Es la primera vez que me pasa algo así. Hace año y medio que comparto viajes y un compa de viajes mejor que el otro! Una lástima realmente, me puse en su lugar y dije: a cualquiera le puede pasar que le roben y necesita ayuda, de una que todo bien! Pero esto de decir una cosa, estirarla y no responder, es una falta de consideración por la ayuda del otro, es mentir al otro, es abusar de la confianza del otro que ni te conocía y te ayudo de corazón. Maximus Magnonimus tu forma de manejarte deja mucho que desear, una lástima por vos...
sale , Hola gente! Yo creo q hay un transporte no tan caro para salir del tigre hasta Uruguay. Alguno sabe? Muchas gracias
busco , Alguien va para misiones en estos días o la semana que viene?
busco , hola alguien viaja mañana sabado 8 de buenos aires capital a Rosario? graciass
sale , Último aviso! En 1 hr viajo de Córdoba a Bs As y me queda 1 lugar disponible
sale , Casandra da Cunha pública lo acá viste como son las redes y la sincronía ☺
busco , Hola gente bonita BUSCO #mendoza - #MardelPlata somos 2 y preferentemente para este jueves 13/4
sale , Buenas! Alguien que vaya de valparaiso a la serena? O a algun lugar cercano? Muchas gracias
sale , Por favor si alguien la ve avise!... Compartan o pongan puntitos para q todos puedan verla... Gracias!!
sale , Hola! Alguien viaja desde Rosario hasta Cordoba en la proxima semana (12/04 o 13/04). Somos 2 y preparados para una buena charla y compartir el nafta. Abrazos!
sale , Buenas gente! Quería saber si alguien de acá de esas casualidades viaja pa' Mardel este domingo, cosa de compartir los gastos y mate!!
busco , Animarse!!????
sale , ali alo ... gente linda ... actualmente estoy en bs as ... y viajo al paraguay ... si alguien tiene una plaza y puede llevarme le estaria muy agradecido pues voy a https://www.facebook.com/convenciondecirco.paraguay/?fref=ts
busco , El finde me voy para Mina Clavero desde Cordoba los que quieren compartir gastos se pueden sumar
sale , Les dejo esta página, es la que mejor ordenada encontré y tiene varios viajes de los que piden Carpoolear tienen que apretar usar aplicación y listo
sale , Holaa viajeiros... Estou em #BsAs... Busco carona para #Rosário ou #Cordoba.. A partir do #sabado estou cpm uma amiga.. Podemos dividir gastos e um bom mate.. Alguem pode nos ajudar?? Desde ja muito obrigado
sale , Hola! Algún viaje de buenos aires a Iquique en las próximas fechas? O algún tramo que ayude? Gracias!
busco , Holaa. Alguien que viaje desde Mendoza a Nuquen, Bariloche, SMAndes?
sale , Un poco de la madre para ustedes.
sale , Hola hermanos!! Alguien sabe si las rutas de Perú están cerradas??
busco , Buenas gente! Somos Agustina y Juan y buscamos viaje con rumbo a #Mendoza para semana santa. Nos encontramos en #SanLuis, si alguno pasa por acá y puede llevarnos sería genial. Compartimos gastos, viajamos muy ligeros y somos respetuosos y puntuales. Se agradece info. Buenas rutas a todos!
sale , Saliendo de comodoro a madryn en 15 minutos un lugar libre
sale , Mañana salgo desde la plata a Rosario, tengo un par de lugares disponibles
busco , 4 cuerpxs qe qeremos ir a mar hermoso el finde qe vienee...!
sale , Hola a Todes !!! Gracias gracias !!! mi amiga Leticia Rosa de los Santos y su hijo gracias a Rafa Salgado esta camino a Bs As a través de Grativiajes. LLEGAN HOY A LA NOCHE SI CONTACTAMOS A ALGUIEN QUE LA TRAIGA DE BS AS HASTA EL BOLSON Ó BARILOCHE SERÍA GENIAL!! COMPARTE GASTOS, CEBA MATE URUGUAYO Y ES UNA HERMOSA COMPAÑÍA... Lugar para dos !!!
sale , Viaje, mañana viernes 7, Las Grutas Río Negro, pasando por Río Colorado, Santa Rosa, Pehuajó, Chivilcoy, Mercedes ( 100km de capital federal), destino San Pedro! Un solo lugar, buen cebador de mates, $500 aprox!
sale , Alguien que venga por la ruta 7 y pase por chacabuco para llevarme a bs as. Voy a zona oeste (moron)...no pude conseguir pasaje y necesito llegar viernes 7 por la mñna si o si.
sale , Buenas.. mañana salgo para Bariloche desde Plottier, Neuquén. . Si a alguien le sirve.. avise nomas... 2995807916
sale , Hola gente hermosa. Necesito ir desde la zona de El Bolsón hasta Buenos Aires. Algún alma que vaya y me quiera llevar? Muchas gracias, buenas rutas!
sale , ¿Qué cambio queres ver en el mundo? Todos los años vienen jóvenes estudiantes de todas partes del mundo a vivir una experiencia de voluntariado en Buenos Aires para realizar trabajos en las ONGs de nuestra ciudad. Desde AIESEC buscamos familias que se ofrezcan a hospedarlos de manera voluntaria. Por qué queremos una familia para los voluntarios? Porque esto les permite tener una experiencia mucho más enriquecedora, y los hace sentirse en casa por 6 semanas!! Entonces, si tenés la posibilidad de hospedar a un extranjero de 2 a 6 semanas, o tenés algún conocido que creés que pueda estar interesado en vivir esta experiencia de intercambio cultural, compartí esta publicación :) https://bit.ly/FamiliasGlobalesArgentina #SiNoSosVosQuien #EstoEsUba
sale , Se que no tiene relacion con el grupo! Pero sepan disculpar.. Es la desesperacion misma! Difundan x favor comenten para que no quede abajo la publicacion y compartan!!! Muchas gracias
busco , Hola! Somos 4 amigas. Buscamos viaje a Bahia desde La Plata o Buenos Aires! Para el Jueves 13 * gracias *
busco , https://m.facebook.com/madanal/posts/1512721712106616
sale , Hola!!! Estoy en busca de algún medio para ir a Punta Indio el jueves 13! Si alguien va y tiene un lugarcito para compartir gastos d viaje porque al ser feriado solo salen dos micros p allá... Gracias!!!
sale , Hola a todos, que tal! Alguien sale de chile para argentina, un amigo esta en santiago y necesita viajar a cordoba..
busco , Hola a todos!! Busco viajero que vaya a San Juan desde Mendoza para semana Santa. Cebo buenos mates :)
sale , El dia once x la mañana sale viaje un lugar bariloche Miramar bs as. X ruta 3 .
sale , Hola! Estoy en buenos aires y necesito llegar a Mendoza el viernes o sábado! Pago los peajes! Soy de san Juan
sale , Desde Uruguay viajo a Entre Ríos Federación termas, dispongo de dos lugares comparto gastos. En turismo día a confirmar.
sale , Buenas...quizas no sea el grupo correcto... Necesito que me orienten si alguien conoce algun camionero... o como poder hacer para traer una moto de Cordoba.... Gracias
sale , Buen dia Viajo hoy de traslasierras a BsAs estoy saliendo casi q ya, pasaria por crdba capital solo si alguien viaja de alli, wsp: 1167088483 Nagual
sale , Hola gente! Dispongo de 3 lugares p viajar desde Bahia Blanca a Río Cuarto el martes 11 a la mañana temprano. Solicitaré colaboración para gastos. Por privado please
sale , Buen dia! Mañana despues del medio dia salgp de comodoro a trelew se solicitan cebadores de mates 2804019400
sale , Buenas buenas!!! Alguien que arranque para donde sea sólo por semana santa? Tengo la necesidad de ver estrellas y verde!!! disfrutar del silencio. Cualquier propuesta es bienvenida, si salen desde Zona Oeste muuucho mejor, pero no hay problema si tenemos que ir para otra zona. Gracias buenas noches! Gonza y Seba ????????
