sale , Lo comparto acá porque es camionero. OJO! Y a los de siempre, que piden pruebas, acá abajo están todas.
sale , Hola a Todos! A modo de consulta, pienso viajar con una amiga a mediados de Junio para Bolivia. Vamos a ayudar en un orfanato y llevariamos varias cosas para ayudar a las nenas de ahí. Por eso es que el pasaje se nos encarece. Y quizás ésta sea una buena idea, alguien hizo este tipo de viaje, Buenos Aires-Bolivia? Cualquier dato es Bienvenido. Saludos❤
sale , Este es el loquito que denuncia la compa Iara. Yo lo agregué ayer a la tarde, mientras viajaba. Hace unas horas encontraron a otra de las nuestras. Una loca más sin poder volver a casa viva.. No necesito, como mina, pedirle a una loca que escracha que cuente qué mierda le pasó para creerle. Hay que dejar de mirar la tele, que nos enseña a sostener el discurso violento de que quien muere por ser mujer, es culpable de cuánto incita, si fuma porro o le gusta salir a bailar. Basta de eso, por favor. Basta porque en cualquier momento le puede tocar a cualquiera de nosotras... Si todos los tipos que dijeron que la loca exagera (como siempre nos pasa cuando saltamos a defendernos o hacer un llamado a la reflexión ante un comentario machiruliento) fueran un toque más vivos y preguntaran a seis de sus amigas o hermanas o madres o tías si alguna vez vivieron una situación de abuso verbal o físico, se darían cuenta que la situación es heavy. La violencia aparece y existe en el micromachismo, como sus comentarios, en la tele, en las preguntas tipo cana cuando haces una denuncia. Y está muy bueno que Iara nos advierta, nos avise, porque está tan del orto todo, que hasta yo corría riesgos teniendo a este tipo de contacto. Y está bueno que esto lo erradiquemos de todos los espacios, grupos de Facebook o Whatsapp. Es la única forma de cuidarnos, y de que estos tipos tengan miedo, y no anden impunes o protegidos por otros tipos.
sale , GRACIAS SEÑOR Azul Mottola POR CLAVARNOS ASI! SOS UN GRAN VIAJERO. Carolina Melisa.. ESPERO NO HAYAS PREPARADO TODO XQ DESPUES DE PREGUNTARLE TANTO.. ME CANCELA
sale , Hola gente !!!! Somos dos chicas y un perrito ... Estamos en #Córdoba y no tenemos donde parar.. si alguien tiene un patio o sabe de algún lugar barateli donde sean amigos de los animalitos ... Agradeceríamos muchísimo la ayuda!!
sale , Hola, perdonen que venga con este posteo de mierda. Pero quiero decir que Jonathan Ezequiel Ruggieri es un psicopata de mierda y que tengan cuidado. Yo se que esta todo bien con la buena onda y eso pero este chabon es un problema, me duele mucho ponerme en esta situacion porque me parece una cagada pero creo que quizas le pueda servir a alguien. Gracias!
sale , Mi papá viaja en auto de Mendoza con destino a Comodoro Rivadavia (Chubut)... Necesita compañía y cobra la mitad del pasaje del destino en donde usted quiera llegar.. Si esta interesado comunicarse al numero 2974220585
busco , Hola amigos, uruguaya retornando al pais, viaje desde #cordoba a #uruguay para la proxima semana?. O #bsas a #uruguay? Saludos y buenas rutas
sale , http://www.labioguia.com/notas/construye-una-estufa-rocket. Vean que buen esto me encantó????????????
sale , Hola! Alguien sabe se un alojamiento barato/ económico en Montevideo - Uruguay? Gracias.
sale , Martes 2 de Mayo salimos desde Villa General Belgrano a Bs As. Compartimos gastos. Tenemos dos lugares disponibles.
sale , Amigos comparto que salio viaje compartido a través de Grativiajes, para Colón, y zonas cercanas Entre Ríos con Johann Sebastian Mastropiero. El viaje fue muy lindo, ruta tranqyila y en 4 horas llegamos a Sanjofiesta Hostel (está en face),un lugar muy copado y su administrador Fabián una masa. Bueno gracias a todos por seguir apostando a la buena Vida, al trato humano y mejor a pesar de tanta cosa inhumana que se permite. Las buenas personas que amamos este Viaje que es la Vida misma, somos más y mejores. Buen Viaje! Buena Vida! Buen Comienzo Hoy! Acá compartimos algunas imágenes.
sale , Sigo buscando alguien copado con un lugarsitooo.soy de tres arroyos, quiero llegar a Cordobaa! graciassssssss
sale , Viajar es una pasión. Un placer adictivo que se disfruta enormemente desde el momento mismo en el que empieza a planificarse hasta que por fin se hace realidad. Pero como no hay viaje sin relato, el moon do a tus pies traduce en palabras experiencias de viaje. Gracias por acompañar, impulsar, motivar, compartir, difundir y ser parte de este proyecto. Sumá tu like y comentarios en https://www.facebook.com/elmoondoatuspies/ que este proyecto necesita seguir creciendo.
sale , Alguno viaja de bahia blanca a cordoba el dia 5 o 6 de mayo? Compartimos gastos.
sale , hola gente... se busca viaje para hoy de rio gallegos al calafate viajo con mi hija de dies alos y un amigo a un encuentro de circo... eapero alguna respuesta se que es poco tiempo pero mañana estare al tanto a partir de las 7 de la mañana... muchas gracias
sale , Hola chicos! Como están? Necesito por favor...por favor sii saben o conocen de alguien q vaya para bs as. Me encuentro en Córdoba capital y tengo/necesito volver. Estoy en 0 total y no consigo laburo. Cualquier data o info se los re agradezco...Saludos miles y buenas vibrasss
sale , Holà a todos ! Somos una pareja de franceses que viajamos por america latina. Estamos ahora en Chili, en Coyhaique. Subimos la carretera australe en dedo. Mañana, quieremos ir hasta Villa Amengual para visitar El bosque encantado y subir mas hasta Puyuhuapi y Chaiten para ir à Chiloe. Eso es el programo por los proximos dias entonces si algunos tiene el mismo trayecto en coche, seria chevere! Gracias. Abrazos!
sale , Hola genteee!! Alguien que viaje de mar del plata a tandil y tenga un lugarcito para mi amiga que quiere venir de visita? comparte gastos y es una copadaaaa ????
sale , Buenas a tod@s! Alguien que esté viajando de #Buenos Aires #Baires a #Bariloche la semana que viene tipo 4/5 de mayo. Comparto gastos, manejo y mates. Gracias y buena semana!
sale , PASAJE GRATIS Hola gente linda, tengo un pasaje de micro para el 5 de Mayo, creía que iba a ir y al final no pude, pero me dijeron que se puede cambiar la fecha. es a CIUDAD DEL ESTE, PARAGUAY. Si a alguien le sirve se lo doy, si me donan unos pesos también me viene bien XD pero sino al menos que no se desaproveche xq ya lo pague.
sale , Hola a todos. Alguien de mardel q haga viajes a santa fe? Trabajo aca y en sf tengo mis nenas. Llevo facturas mate y arrimo unos pesos. El pasaje esta muy caro. Gracias.
busco , Hola! Alguien que viaje a ver #LaRenga a Córdoba desde El Bolsón ó Bariloche?
sale , Hola gente vamos a la renga . buenos aires. rosario cordoba . La vuelta cordoba .la pampa. rio negro .puerto madryn . Y la vuelta hacemos puerto madryn buenos aires .tenemos lugar para llevar y traer cosas .gracias .
busco , encontre esto, para los q tienen visa, es muy buen precio!!!
busco , Hola!!! Alguien que viaje de Córdoba a Buenos Aires? Gracias!!! ????
sale , Hola! Busco viaje desde Mar del Plata a La Plata o Buenos Airea para el viernes 5/5. Somos dos cebamos mates muy ricos y hacemos unas galles exquisitas )
sale , Hola! Buena alternativa solidaria. He notado que las publicaciones son en Argentina o cercanos, no hay para otros países?
sale , Gente soy de Buenos Aires Zona Oeste Ituzaingo , mañana alguno sale para rosario para compartir gastos?llevo anecdotas , chistes y cebo unos buenos mates con un poco de rock !!! Copensen
sale , Marcelo es correntino, tiene trastorno bipolar....su familia lo busca desesperadamente....se ausentó de su hogar sin decir a dónde iba pero afirmando que iba a regresar....no llevó su teléfono, ni ropa, no se comunicó nunca más....queremos saber dónde está, si está bien....que le pasó todo este tiempo.... SE RUEGA DIFUNDIR!!!
sale , hola acabo de llegar a buenos aires depues de un viaje terrible!! resulta que venia con mamani, todo bien con el excelente persona,,, bueno el no salio nunca y me paso a otro camionero un señor bastante agradable todo, iba bien ibamos llegando al peaje de rosario con direccion a buenoa aires y se le perdio la billetera y a quien culpo a mi!! claro la pobre que viaja a dedo y justamente antes que se baje me roba la billetera....piensa el ..cosa que obvio no fue asi yo no tenia idea de su puta billetera y le digo que revise mis cosas me dice que me llevara a la policia por robo le digo porfavor yo no e hecho nada no me lleve donde esos policias que todos sabemos son corruptos y aunque encontraran la billetera me culparian a mi pues estaba pàrada justo en el lugar preciso, entonces desespera sin saber que hacer pasando mil cosas por mi cabeza le dije que buscara que debia estar por ahi que porfavor no me llevara con la policia ademas perderia todo el tramite que vine a hacer aca y quedaria sin ingreso a la universidad pues no tendria otro turno imaginense todo el paronama..en fin derenpete la billetera aparece por obra de magia en un lugar que nada que ver y me dice perdon perdon no te quise ofender, le dije no pasa nada me baje y a las cinco de la mañana tube que caminar hasta el peaje animicamente muy mal.. pasaron unos buses hasta que uno me llevo....bueno les cuento esto para que sepan lo peligroso que puede llegar a ser esto... yo lo hize por que en este pais el monopolio de las empresas de buses y la fata de fiscalizacion es tan grande que los pasajes son altisimos y no alcanza para comprarlos y eso es lo que hay que cambiar que este monopolio termine ya que solo nos perjudica a nosotros!!! espero nadie vuelva a pasar por algo asi..cuidense!!
sale , Buenaaasss! Alguien que vaya a Loberia mañana?
busco , Mañana 27/04 tuitazo por Araceli a las 12hs. Se ruega difusión! #AraceliTeEstamosBuscando
sale , Hola!! Buenas buenas!! De San Marcos Sierra o Córdoba capital a Bs As, el 1 o 2 del proximo mes!? O informacion. (Tengo que llegar a la facu) se agradece mucho! Saludos!
sale , Alguien de san rafael que valla a mendoza?
sale , Buenas, de casualidad alguno viaja al ResistenciaViva a ver a A.N.I.M.A.L/Malon/Horcas semana del 20 de mayo para Bahía blanca o Chubut? Somos dos hermanas de Lanus compartimos gastos y buenisima onda ????
busco , Buenas! Alguien va de la paz a Arica Chile en estos días somos dos chicas! Pintoras buena onda jiji ????
sale , hola gente!! quien sale para rosario o venado tuerto el domingo por la mañana?? comparto mates y masitas ya que no poseo dinero. gracias
busco , hola alguien va de suarez a bahia hoy o mañana?
sale , Buenas gente! Alguien que salga desde #cordobacapital Hasta #capitalfederal? (Buenos aires) En estos días? Ando en capilla del monte y puedo ir hasta la capital de Córdoba. Buena onda y comparto gastos! Abrazos!!
sale , quería comentar mi humilde opinión sobre el tema de este muchacho Ruggeri o como se llame. yo no digo que lara mienta, para nada, y si.. el tipo parece raro, pero la publicación de esta chica es muy poco descriptiva, no da detalles de por que lo acusa asi, no digo un screenshot , pero mínimamente explicar el porqué, juzgar y acusar a alguien sin saber por que se lo acusa, solo x ser hombre, es machismo tmbn. Y si era alrevez y yo , por ejemplo , publicaba que una chica del grupo me acosaba y era una pervertida pero sin explicar xq y que hiso, que me iban a decir? eso es machismo tmbn.. y ami me pone muy triste sinceramente como las mujeres y los hombres somos víctimas de este sistema y esta estructura machista, y comprendo que las mujeres son victimas latentes de todo esto, y me rabia e impotencia , y quisiera que todo fuera distinto, de verdad gente, pero tmpc increpar a alguien sin saber nada ni ningún dato que lo califique de pervertido y acosador.. espero se entienda mi postura escrita con respeto y sin malas intenciones. paz
sale , Alguien de bahía que me tiré hasta el fito sanitario?
sale , Salgo este viernes temprano a San Luis desde Rosario, tengo dos lugares! Compartimos gastos, ya somos dos...
sale , buscoviaje. Saliendo de #corrientes sábado 29 o domingo 30 hasta #buenosaires. Me acerco a algún lugar, comparto gastos, mates y algo rico!
sale , 29 de mayo DESDE LLAVALLOL A JUJUY EN BICICLETA...SOLO..LA IDEA DE MI VIAJE ES LLEVAR ALEGRIA A LOS OLVIDADOS...TAMBIEN AYUDAR A LOS QUE MENOS TIENEN X ESO PENSABA CADA KM RECORRIDO SEA 1 KG DE ALIMENTOS... SUPONGAMOS SALGO DE LLAVALLOL A PILAR...80 KM BUENO LLAMAR ALGUNA RADIO DE ALLA CONVOCAR A LA GENTE Y JUNTAR LOS KG DE ALIMENTOS..Y QUE LOS BOMBEROS LO REPARTAN A QUIEN CREA NESECARIO....EN CASO DE QUE LA GENTE NO SE SUME A ESTA CRUZADA( que puede pasar) A MI REGRESO JUNTAR JUGUETES GOLOSINAS Y HACER UN FESTIVAL PARA LOS CHICOS...Y TAMBIEN JUNTAR ROPITA ESCARPINES ZAPATILLITAS MAMADERAS SACALECHES MANTAS PARA LA GENTE DE PEDIATRIA MATERNIDAD NEONATOLOGIA DEL HOSPITAL GANDULFO....COMO SIEMPRE A PULMON....
sale , hola, buenas noche. llegue ayer de brasil. estoy en capital federal y voy hacia mar del plata. si hay alguna alma solidaria que vaya para alla o cerca, aviseme por favor, aporto para el combustible. muchas gracias
sale , Hola gente bella. Para los que vengan a Cordoba sigue mi casita disponible para el que lo necesite. Pasar la noche, darse una ducha, comer algo rico o tomarse unos de mis ricos cafés.. Perdón que no estuve al tanto de la pagina anduve con mucho trabajo en la veterinaria. Pero aquí estoy lo que necesiten :) ni lo duden.
sale , :) siguen llegando visitas a casa llenando de buenas vibras y hermosa energia. Me encanta haber encontrado este lindo grupo.. Espero recibir mucha mucha gente mas. @ale gadea una masa el pibito . Se llevo un rico cafe hoy .. Que tengan lindo dia y buenas rutas ...
sale , Y estas son las cosas que me llenan el alma y me dan mas pilas para seguir haciendo esto que amo. Ayudar. Lo hago en la veterinaria con los seres maas hermosos del universo.. Y ahora con la gente bella
sale , AQUI DE NUEVO.. :) ASI COMO LES MOSTRE MI CAFE. LES PRESENTO MI HUMILDE HOGAR. PARA CUANDO PASEN DE VISITA A CORDOBA PUEDA RECIBIRLOS DE LA MANERA MAS LINDA Y CONFORTABLE.. DE ALGUNA FORMA VAMOS A ACOMODARNOS. PREFIERO MIL VECES ABRIR LAS PUERTAS DE MI CASA A PENSAR QUE PUEDAN PASAR UNA NOCHE EN LA CALLE Y MAS COMO ESTÁN LAS COSAS HOY EN DIA.. BUENO GENTE LES DESEO UNA HERMOSA TARDE Y UN LINDO FINDE
sale , Gente bella.. Cuando viajen a Cordoba capi. Y necesitan darse una ducha o quedarse . :) bienvenidos sean mi casa tiene las puertas abiertas . Mates. Comidita y cafés ricos , pelis y libros. Nunca faltan.
sale , Hola gente como va ? Alguien que salga desde capital federal o alrededores entre el lunes 1 de mayo y el miércoles 3 de mayo para Córdoba capital por favor !! Soy yo sola algún alma solidaria me voy a ver a La rengaaa .. Avisen saludos !!
sale , SALE VIAJE MAÑANA DE BARILOCHE A ROSARIO AL MEDIO DÍA UN LUGAR
sale , Amigos viajeros. ya en mi penultgima dia en buenos aires. que lugar cercano me recomiendan conocer. sin tanto tiempo de viaje. gracias.
busco , Buenas noches!! alguno que viaje para el lado de Mercedes este finde? Seriamos mi hijo de 5 y yo. Se agradece! :)
busco , Holaaa. Alguien va a Córdoba el jueves 4, viernes 5 o sábado 6?????????????????????
sale , Hola gente!. Alguien que valla para Chile o lo mas cercano y tenga un lugarcito. Compartimos gastos.gracias
sale , Hola gente de San Luis! Estuve alojando a tres viajeros en casa, dos chicos y una chica. Son muy piolas! Si alguien tiene lugar en su hogar para que se queden unos días más por acá sería genial! :D
sale , Alguien que viaje de Tandil a Buenos Aires el sábado a la noche o domingo a la mañana? Somos tres y compartimos gastos Mariana Guille También necesitamos volver el.mismo domingo de Buenos Aires a Tandil
sale , Buenas gente! Busco compañer@s para viaje en auto Origen: Puerto Madryn Fecha estimada de salida: 17/5 Destino flexible: Buenos Aires, o Mendoza.
busco , Hola viajeros, somos 2 amigos mochileros de buenos aires percusionistas, estamos por San Luis y el lunes 8 de mayo queremos partir hacia Mendoza por ruta 7
sale , Hola, Estoy buscando un viaje para este fin de semana a bsas (zona oeste) desde tandil. Si alguien tiene un lugar me escribe? Gracias!
sale , Sintetizo aquí (pero cualquiera puede leer la situación completa en el otro post): NO ACEPTEN NI CREAN NADA QUE LES OFREZCAN EN LOS SIGUIENTES NÚMEROS. SON INESCRUPULOSOS CON TIEMPO AL PEDO PARA JOROBAR A LA GENTE. NO SE DEJEN ESTAFAR. NINGUNO DE ESOS NÚMEROS DE CELULARES CORRESPONDEN A PERSONAS HONESTAS. NO ACEPTEN NINGUNA OFERTA QUE PROVENGA DE ELLAS. SÓLO LES HARÀN PERDER EL TIEMPO. (Los nombres probablemente sean falsos). Carina Mercado Libre. / chofer del paraguay: 15 2404 2809 Adrián: 15 Legales). David, traslado de Mascotas (pág de facebook): cuando le pedís datos para corroborar su identidad se cae el viaje (habría que denunciarla pág a Facebook.) Página oficial de la empresa que supuestamente sólo hace encomiendas. Ojo!, tiene muchos comentarios de gente denunciando que las encomiendas llegan abiertas y con faltantes), como podrán ver en este link (ojo con sus encomiendas): http://www.argentino.com.ar/integral-pack-express-F1608C704… 1 dato a tener en cuenta: To2 estos jodones tienen imágenes de gatitos como foto de perfil de wp. Por mi parte, ya estoy en contacto con gente de la CNRT, la secretaría de turismo, policía federal y abogados para demandar a toda esta manga de delincuentes. Gracias x su tiempo y tengan cuidado. HAY MUCHO GARCA DANDO VUELTAS.
sale , hola buenas noches ,estoy buscando viaje para dos personas, desde puerto madryn hasta bahia blanca ,,si alguien tiene algun dato les doy las gracias
sale , Si voy a mulear por lo menos q sea para algo positivo. le tire 5 gambas por la primer semana de laburo. si todo sale bien, volvemos a valpo a ver a los amigos con el amigo de Mamani hasta mendoza y despues un par de dedo hasta santiago :) sea para fines de mayo, si alguien gusta, es bienvenido. Saludos !
sale , Alguien que viaje a ver a La Renga a Jesus Maria y le sobre un lugar? Estoy en Rosario, divido gastos #LaRenga #JesusMaria #Rosario #Cordoba
sale , Si voy a mulear por lo menos q sea para algo positivo. le tire 5 gambas por la primer semana de laburo. si todo sale bien, volvemos a valpo a ver a los amigos con el amigo de Mamani hasta mendoza y despues un par de dedo hasta santiago :) sea para fines de mayo, si alguien gusta, es bienvenido. Saludos !
sale , Viajeros. Voy a santa fe desde cordoba por la ruta 19. Si alguien puede darme una mano y acercarme estaría muy agradecida. Tambien Busco alojamiento por una noche en Santa fe o Paraná. Viajo sola. Buenos vientos.
sale , Buen dia amig@s!! Busco compartir viajecito desde Rio Cuarto a Merlo, San Luis este sabado!? Si alguien tiene un lugar Aviseeenn!!! ???? Graciasss!!! ida), incluye una ida al Parque Nacional El Palmar día a coordinar en el viaje (si es ida y vuelta osea 400p). El servicio de DJ y las clases que estoy dando sobre música no las estoy cobrando por el momento. Al mismo tiempo si alguno quiere proponer un lugar que no pase los 600km y me convence podría cambiar el destino. Saludos y gracias como siempre por la buena onda!
sale , De Mina Clavero para Cordoba?? Alguien que tenga un lugar... de aca al Sabado en cualquier momento.
sale , Alguien que valla de mendoza a santiago chile? Desde ya muchas gracias
sale , hola! viaje a bs as. queria saber que opciones buensas de bares hay para esta noche. muchas gracias.
sale , Amigos de la ruta somos PAME Y LEA Un par de Yoruguay (uruguayos) diseñadores, que hace un año y medio comenzaron un viaje camino a Méjico. Salvando las distancia, el viaje nos tomo otro rumbo y nos dirigimos finalmente camino a Torres del Paine- Chile, no todo es controlable en la ruta... Así que aprendimos a fluir ... a vivir haciendo dedo, en un viaje lento que trata de compartir . Año y medio entre ARGENTINA Y CHILE , asi que cualquier consulta en que podamos ayudar a las ordenes somos nuestras raíces! www.enraiz.net
sale , Hola mochilas! Los invitamos a seguirnos en nuestra página El sueño que te guía - blog de viajes Subimos información y tips de viajes que le pueden ser útil y estamos para responder cualquier duda. Les comparto nuestra nota de #Laisladelsol Saludos desde Cusco! Buenas rutas!
sale , Hola gente quiero ir a córdoba traslasierra la semana que viene si hay un lugar lo agradezco
busco , Hola gente!! Estoy buscando viajecito a cordoba desde bs as, yo estoy en zarate. Si alguien va me chifla,compartimos gastoss
busco , Holis viajerix! Alguien que viaje de sanluis o mendoza a capital o la plata para este finde o el proximo?
sale , Alguien que salga de El Bolsón o Bariloche hacia Bs As el viernes de la semana que viene? Cebo mates, aporto para nafta, y me gusta charlar, pero se reconocer cuando es suficiente ????, también manejo y tengo registro. Gracias, que tengan buen día ????
sale , Holaaaa!!! Somos dos viajeras y un tambor rumbo a brasil... manejamos y charlamos lindo lindo... alguien con ese rumbo en estos dias? ????????
sale , Alguien que vaya a #Corrientes el 5 de mayo o el 6 muy temprano? Desde #BuenosAires 36 Km | 0:08 hs RN 38 Cruz del Eje 68 Km Km 104 | 1:19 hs RN 60 Deán Funes 28 Km Km 132 | 1:40 hs RN 60 Quilino 90 Km Km 222 | 2:48 hs RN 157 Cruce RN 60 y RN 157 26 Km Km 248 | 3:08 hs RN 157 Recreo 43 KM Km 291 | 3:40 hs RN 157 San Antonio de la Paz 35 Km Km 326 | 4:06 hs RN 157 Frías 50 Km Km 376 | 4:44 hs RN 157 Lavalle 27 Km Km 403 | 5:04 hs RN 157 San Pedro de Guasayan 18 Km Km 421 | 5:18 hs RP 333 La Madrid 38 Km Km 459 | 5:46 hs RN 38 Juan B. Alberdi 24 Km de asfalto Km 483 | 6:04 hs RN 38 Aguilares 9 Km de asfalto Km 492 | 6:11 hs RN 38 Concepción 21 Km Km 513 | 6:27 hs RN 38 Monteros 5 Km Km 518 | 6:31 hs RP 307 Acheral 7 Km Km 525 | 6:36 hs RP 307 Santa Lucía 49 Km Km 574 | 7:50 hs RP 307 El Mollar 11 Km Km 585 | 7:58 hs RP 307 Tafí del Valle 56 KM Km 641 | 8:40 hs RP 357 Amaicha del Valle 14 Km Km 655 | 8:50 hs RN 40 Cruce RP 307 y RN 40 3 Km Km 658 | 8:52 hs RN 40 Calimonte 15 Km Km 673 | 9:03 hs RN 40 Colalao del Valle 33 Km Km 706 | 9:28 hs RN 68 Cafayate | 126 Km Km 832 | 11:02 hs RN 68 Coronel Moldes |24 Km Km 856 | 11:20 hs RN 68 El Carril 21 Km Km 877 | 11:36 hs RN 68 Cerrillos 15 Km Km 892 | 11:47 hs RN 9 Salta | Hoteles 8 Km Km 900 | 11:53 hs RN 9 Vaqueros13 Km Km 913 | 12:03 hs RN 9 La Caldera 70 KM Km 983 | 12:55 hs RN 9 El Carmen 24 Km Km 1007 | 13:13 hs RN 9 San Salvador de Jujuy 7 Km Km 1014 | 13:18 hs RN 9 Jardín de Reyes 13 Km Km 1027 | 13:28 hs RN 9 Yala 20 Km Km 1047 | 13:43 hs RN 9 Volcán 20 Km Km 1067 | 13:58 hs RN 52 Cruce RN 9 y RN 52 4 KM Km 1071 | 14:01 hs RN 52 Purmamarca 65 Km Km 1136 | 14:50 hs RN 52 Pozo Colorado 20 Km Km 1156 | 15:05 hs RN 52 Tres Pozos 50 Km Km 1206 | 15:43 hs RN 52 Susques 155 Km Km 1361 | 17:39 hs RN 27 Paso de Jama 160 Km Km 1521 | 19:39 hs RN 23 San Pedro de Atacama 100 Km Km 1621 | 20:54 hs RP 24 Calama 15 Km Km 1636 | 21:05 hs RP 24 Chuquicamata 72 Km Km 1708 | 21:59 hs RN 5 María Elena 224 Km Km 1932 | 24:47 hs RN 5 Humberstone 248 Km de asfalto Km 2180 | 27:53 hs r 5 Arica 43 Km Km 2223 | 28:25 hs r 1 Tacna 149 Km Km 2372 | 30:17 hs R 1 Moquegua 157 Km Km 2529 | 32:15 hs R1 Cruce 1 y 112 54 Km Km 2583 | 32:55 hs R1 El Pedregal 79 Km Km 2662 | 33:54 hs R1 Camaná 176 Km Km 2838 | 36:06 hs R1 Chala 50 Km de asfalto 36:44 hs R1 Yauca 121 Km Km 3009 | 38:15 hs PE1-S Nazca 148 Km Km 3157 | 40:06 hs PE1-S Ica 50 Km Km 3207 | 40:44 hs PE1-S Desvío a Paracas 15 Km Km 3222 | 40:55 hs PE1-S Pisco 34 Km Km 3256 | 41:21 hs PE1-S Chincha Alta 75 Km Km 3331 | 42:17 hs PE1-S Cerro Azul 99 Km Km 3430 | 43:31 hs PE1-S Punta Hermosa 35 Km) Km 3465 | 43:57 hs PE-1N Lima 73 Km Km 3538 | 44:52 hs PE-1N Chancay 79 Km Km 3617 | 45:51 hs PE-1N Huacho 142 Km Km 3759 | 47:37 hs PE-1N Huarmey 79 Km Km 3838 | 48:36 hs PE-1N Casma 56 Km Km 3894 | 49:18 hs PE1-N Chimbote 132 Km Km 4026 | 50:57 hs PE1-N Trujillo 33 Km Km 4059 | 51:22 hs PE1N Chicama 88 Km Km 4147 | 52:28 hs 1N Desvío a Cajamarca 10 Km Km 4157 | 52:36 hs PE-1N Guadalupe 4 Km Km 4161 | 52:39 hs PE1-N Chepen 36 Km Km 4197 | 53:06 hS PE1-N Mocupe 36 Km Km 4233 | 53:33 hs PE1-N Chiclayo 13 Km Km 4246 | 53:43 hs PE1-N Lambayeque 201 Km Km 4447 | 56:14 hs PE1-N Piura 37 Km Km 4484 | 56:42 hs PE1-N Sullana 76 Km Km 4560 | 57:39 hs PE1-N Talara 50 Km Km 4610 | 58:17 hs PE1-N Los Órganos 14 Km Km 4624 | 58:27 hs PE1-N Mancora 21 Km o Km 4645 | 58:43 hs PE1-N Punta Sal 48 Km Km 4693 | 59:19 hs PE1-N Zorritos 30 Km Km 4723 | 59:41 hs PE1N Tumbes 25 Km Km 4748 | 60:00 hs PE1N Aguas Verdes 3 Km Km 4751 | 60:02 hs R 25 Huaquillas 32 Km Km 4783 | 60:26 hs R25 Cruce 25 y 92 28 Km Km 4811 | 60:47 hs R25 Machala 109 Km Km 4920 | 62:09 hs R 70 Cruce rutas 25 y 70 29 Km Km 4949 | 62:31 hs R60 Cruce rutas 60 y 70 112 Km Km 5061 | 65:19 hs R35 Cajabamba 20 Km Km 5081 | 65:34 hs R35 Riobamba 55 Km Km 5136 | 66:15 hs R35 Ambato 41 Km Km 5177 | 66:46 hs R35 Latacunga 55 Km Km 5232 | 67:27 hs R 35 Alóag 25 Km Km 5257 | 67:46 hs 35 Quito 80 Km ) Km 5337 | 68:46 hs r 35 Otavalo 22 Km Km 5359 | 69:02 hs R35 Ibarra 75 Km Km 5434 | 69:58 hs R 25 Tulcán 20 Km Km 5454 | 70:13 hs R25 Ipiales 82 Km Km 5536 | 71:15 hs R10 Pasto 103 Km Km 5639 | 72:32 hs R45 Mocoa 327 Km Km 5966 | 76:37 hs R 45 Neiva 145 Km s Km 6111 | 80:15 hs R 40 Espinal 39 Km Km 6150 | 80:44 hs R 40 Melgar 109 Km Km 6259 | 83:28 hs Bogotá Ta
sale , Hola gente.. Disculpen que moleste por acá. Pero necesito saber si existe algun grupo en face de viajeros con perros..es decir. .que salgan viajes y se permita llevar perros. Otra pregunta es..creen que sera mas dificil si es un pitbull? La verdad es que tengo muchas ganas de irme a viajar pero no quiero y no puedo dejarlo. Siempre soy precavida y el tiene su bozal. Necesito opinines que me ayuden...no se que hacer! No cuento con mucho dinero. Los leo..gracias!!! Soy de Tandil
