sale , Finde largo Primero de Mayooooo INTERCAMBIO: Ofrezco tres noches de alojamiento para dos personas en mi depto de Mardel,q es enooorme (tres habs,tres baños...) muy cómodo para compartir. Sólo estaría yo,q voy a resolver cosillas y conocer la bebita de una amiga. La cocina se re puede usar p cocinar obvio :) Es en pleno centro,a dos cuadras del mar! Qué necesito? Lugar en un auto de Capi a Mardel,saliendo domingo 30 tempranito y volviendo el miércoles. GRACIAS!!!
sale , PERDÒN,QUE TIENEN QUE VER LOS PASEOS PERRUNOS Y LAS AYUDAS SUPUESTAMENTE ENERGETICAS Y ESPIRITUALES CON LOS VIAJES??NO ES QUE SOLO SE PUEDE PUBLICAR SOLO LO QUE TENGA QUE VER CON VIAJES??HACEN PUBLICIDAD GRATIS ESTA GENTE??
busco , Hola! Busco viaje de #resistencia a #salta , dos personas y dos mochilás. Podemos compartir gastos, artesanía y música. Queremos salir hoy o mañana :)
sale , Je suis Mahaut, française de 26 ans. Je voyage seule en Amérique du sud depuis la Colombie et je compte faire un road trip en Argentine. Départ prévu le 21 ou 22 avril de Mendoza, descente jusqu'à El Calafate par la route 40 (côte ouest). Voir le Perito Moreno, El chalten etc etc . Retour prévu le 21 mai. Sur ma route j'ai réussi à embarquer Clémence, française (26 ans). Et sûrement Mathieu (27 ans). Nous sommes donc à la recherche d une à deux personnes pour partager cette expérience avec nous. On est facile, organisées, du matin. On aime les grands espaces, le vin, la musique de tout horizon. Les frais seront divisés par 4 ou 5 en comptant la location de la voiture (van 7 places ou voiture 5 places dans le pire des cas mais on va négocier le van une fois sur place), l essence, les péages, prévoir les entrees sur les sites naturels, du camping et qq auberges et la nourriture sur la route en fonction de ses moyens. Art. 22 chacun fait comme il peut. Budget max : 1.000€ (Grand max ce serait le top) pour le mois Si tu es motivé pour nous rejoindre et disponible, envoie moi un mail et on se capte très vite pour s'organiser :) Merciiiii Mahaut
sale , Hola gente viajera !!!! Vamos a viajar con mi compañera desde Campana (zona norte de Buenos Aires) hasta San Martín de los Andes el día 3/05/17 tenemos 2 lugares disponibles en el auto y compartimos gastos PD: si uno tiene carnet de conducir mucho mejor jaja
sale , Jesuses de los viajes, estoy tratando de ir hasta mar del plata desde bs as este viernes, si hay alguno que quiera ir compartiendo formalmente el viaje, pueden decirme y organizamos. Gracias PD: es importante
busco , Alguien que viaje a #cordoba #jesusmaria para ver a La Renga?? Somos 2!
sale , Hola gente viajera! Me llamo Jan, soy un alemán de 18 años viviendo actualmente en Buenos Aires. En las dos semanas que quedan hasta domingo 07/05, voy a viajar paso a paso desde Calafate a Bariloche. Si alguien va en este camino (Ruta 40), me querría asumir (..por ejemplo el martes que viene desde Calafate a El Chaltén). Claro que comparto gastos! Gracias!!
busco , Hola! Alguien que vaya para Capital este Viernes 28/04 desde Rosario?
sale , Hola gente bella Alguno viaja para la rioja en estos días y sale de capilla del monte cordoba o pasa por aca!???
sale , Grativiajeroois, alguno viaja mañana psra el lado de tres arroyos desde tandil???
sale , Gente linda, comparto por aquí mi página que andaba medio abandonada pero la estoy REactivando y me ayudarían muchísimo con tan solo un Like! Mil gracias y buena ruta (la vida misma). :)
sale , Gente linda, comparto por aquí mi página que andaba medio abandonada pero la estoy REactivando y me ayudarían muchísimo con tan solo un Like! Mil gracias y buena ruta (la vida misma). :)
busco , Buen diaaaa... somos 2 y estsmos en argentina... vamos rumbo a brasil... llevamos buena onda y buenas charlas en la mochila... compartimos gastos y manejamos... hay alguien por ahi?
sale , Hola grupo alguien sabe de un hospedaje o hostel q hagan voluntariado o barato en capilla del Monte. Se agradece toda info saludos !!
sale , Alguien que vaya de Junin a Baires mañana?
busco , Buenas! somos tres y buscamos viaje #desdeBsAs hasta #Santiagodelestero para estos dias, compartimos por supuesto gastos, mates buena onda! gracias x el eapacio y saludos a todxs!!!
busco , Perdon. A Mar del Plata desde Bs As
sale , Hola. Alguien que salga para Mar del Plata en estos dias? Somos dos. y llevamos algo rico para los mates
busco , busco llegar a tres arroyos viernes somos dos
busco , Alguien que salga hoy (lunes) de Olavarría a capital?
sale , Hola gente lindaaa!! El sábado a las 9 de la mañana estamos saliendo de Posadas hasta Buenos Aires por si alguien quiere sumarse!! Hay 3 lugares ????
sale , Hola gente...tengo que mandar una caja de miel a bs as capital...si alguien sale de bolson para alla le truequeo miel y dulce de membrillo por el flete...besos
busco , hola alguien q viaje para Mendoza en estos dias!! estoy en buenos aires!! gracias!
busco , Agradecidos por la aceptación. ¡Saludos cordiales!
busco , Hola! :) Alguien que vaya de #Córdoba a #SanJuan o #Mendoza este viernes?
sale , Holaaa gente! Busco viaje desde #cordoba a #santiago de chile o #mendoza .. Sin fecha me da igual cuando... Comparto gastos
sale , Hola!! Busco coche para llegar a Buenos Aires desde Cordoba el dia 7 de mayo! Comparto costes de viaje, musica y Buena compañia! Gracias!
sale , Buen día estimados. Busco viaje a #Neuquén para los primeros días de Mayo. Comparto gastos y cebo mates. Salgo desde #SanMartíndelosAndes o #JunindelosAndes ! Muchas gracias.
sale , Buenas gente! Estoy subiendo hacia capilla del monte (Córdoba) desde huanca renanco (Córdoba) si alguien en el tramo en el medio se copa, el destino es hermoso!! Abrazooo
sale , Ofresco viaje de Bs as a mar del plata hoy domingo 20hs 1 lugar!!
sale , Alguien de San Rafael (Mendoza) a mendoza capital ahora?
sale , Comparto mi fanpage viajera para ayudarte y motivar a los que aún no se animan a cumplir sus sueños. Apoya y seguí la web dando un me gusta: https://www.facebook.com/viajandoconeluru/
sale , Alguien que me pueda llevar a baires desde mardel el viernes 28? Y tmb necesito retorno sábado o domingo!! Bella noche a todxs!!
sale , Amigos estoy yendo a la estación de servicio ELOY GUERRERO , pasando San Martín en dirección a buenos aires. Estoy caminando por la ruta , si alguien ve un mochila con la remera de BELGRANO DE SAN NICOLÁS soy yo jajajaja. buenas ondas
sale , Hola! Busco viaje de #buenosaires a #bariloche para mi O para mis cosas. Necesito poder ir llevando la mudanza: tres cajas y tres valijas. Asi no tienen lugar para mi, pero si en el baúl ya me estarían re dando una mano. Gracias!!!!
sale , Hola gente, alguien conoce/recomienda algún camping con dormis u hostel cerca del río en gualeguaychú, entre ríos?? gracias desde ya
busco , Busco viaje a buenos aires desde él bolsón o desde bariloche cualquier dato se agradese viajo solo con la mochila!
sale , Holaaaaas????..si alguien tiene lugar para misiones oo cerca,dos personas somos!..podemos compartir gastos..abrazos
sale , Hola hermanos! Renuncio a todo lo planeado y busco grati viaje para el lado de san luis mendoza chile, soy yo con mi guitarra, cebo mates y les canto!! Por favor saquenme de esta ciudaaddd!!!
sale , Buenas tardes viajeros de rutaaas.. el finde largo del 1ro de mayo. Quien sale de la plata para 3 arroyos?? Somos dos amigos.. buena onda,charlas de vida, música y los mejores mates q hay.. ojala alguien aparezca. #ViajarSiempre
sale , Hola mochilas! Les comparto la última nota que escribimos. Esperamos que les sirva. Si tienen alguna duda nos escriben. Buenas rutas! El sueño que te guía - blog de viajes
sale , Alguien que valla para el norte antes del 29??
sale , Un lugarcito, para el martes tempranito! Tandil tres arroyos, quien me quiere llevar???
sale , Busco viaje a Rosario para el viernes 27 de este mes. Comparto gastos y buena onda
busco , Alguien sale para #córdoba este viernes 28 de abril?
sale , Holaaaaa alguien tiene algún dato de para ir de Sao Paulo a buenos aires por precio barato? No precisa ser un obnibus muy confortable! Jaja si alguien va de auto divido gastos! Gracias !!
sale , Buscamos Viaje de #Cordoba a #Buenos aires miércoles 26 de abril. Somos dos. Gracias
busco , Buen dia todos! Necesito viajar a Colonia o Montevideo este lunes o martes!
busco , Hola nesesito viajar desde Río negro(San Antonio Oeste)hasta bs as comparto gastos y buena compañía
sale , Alguien yendo a cordoba en esta semana??? Del 24 al 28????
sale , Alguuen que me pueda llevar a baires desde mardel el viernes 28? Y tmb necesito retorno sabado o domingo!! Bello dia a todxs!!
busco , Buscoviaje #mendoza a #san luis
busco , hola! queremos viajar a Buenos Aires el domingo 30 tempranito. compartimos gastos. somos 2!
busco , Buenas !! Alguien que viaje desde Bahía Blanca a Bariloche la semana que viene ?? Gracias !!!
sale , Quien anda por Tucumannn.! Somos 3 mochileras y vamos de TAFI DEL VALLE a CAFAYATE. ♡ si alguien anda por ahi estaremos haciendo dedo... un abrazooooooo fuerte.! Desde ya gracias por leer.
sale , hola grupo ???????? alquilo habitación en #rosario para el 2 de mayo
sale , Holaa Busco viaje desde buenos aires Hasta córdoba Entre el 1 y el 3 de mayo Gracias!!
sale , Holaaa estoy en Floripaa.... Alguien que vaya para uruguayana estos dias???? Comparto comidita casera para el viaje y los mates!!!! Y buenaa energiaaa!!!
busco , Buenas tardes grupo????⛺️????
busco , Hola a todos!! Estoy en Buenos Aires en capital y voy para las cataratas, la idea es salir en Lunes. Si alguien va por alla o por lo menos algo en la misma dirección me ayudará mucho. Buen cevador de mates y soy de buena charla (: Saludos (:
sale , Hola alguien en Mendoza que me dé un aventon voy hasta buenos aires , Rosario. Cualquier dirección que me acerque unos km bienvenido sea.. abrazo y gracias. Ya toy listo
busco , Buscoviaje #mendoza a # buenos aires
sale , Buenas! Somos 3 personitas que vamos a mar del plata el miércoles 26/04. Compartimos gastos, charlamos, cebamos mates o nos llamamos al silencio Avisar si sobra algún lugar. #mardelplata Muchas gracias!
busco , Aalgun ser humano que vaya de #Misiones a #florianopolis o por ahi cerca? Estamos en Puerto Iguazu, no somos muy simpaticas pero tenemos comida.
busco , ¡Hola! Saudações viajeros.
sale , HOLA! PERDÓN POR GRITAR XD NECESITO IR A CHILE EL 7 O EL 8 A MÁS TARDAR, ESTOY EN ZONA NORTE (BS AS) AUNQUE PUEDO ACERCARME UN POCO DE SER NECESARIO, OBVIAMENTE AYUDARÍA CON LOS GASTOS, SI SABEN DE ALGO NO DUDEN EN AVISARME TAMBIÉN ME AYUDARÍA SI ME DICEN SI HAY FORMA DE CONSEGUIR PASAJES BARATOS, GRACIAS DE ANTEMANO.
sale , Hola estoy con un amigo en santa rosa y vamos para TAndil ¿alguien sale para alla? Compartimos gastos cebamos mate y buena onda ????
busco , Cansancio y felicidad... ¿La 8va maravilla natural?
busco , Buenas, BUSCO VIAJE, alguien sale en estos días de Córdoba para Tucumán? Necesito mandar una cajita.
sale , Hola! Estoy pensando en hacer un grupo de whatsapp de mochileros en Uruguay. Sería para aquellos que ya están en Uruguay o están llegando en unos días. Yo soy uruguaya por lo que les puedo dar consejos, ayudar en caso de que lo necesiten, salir a recorrer en el día o salir en la noche. Quienes quieran unirse me pasan número, nombre y nacionalidad para agregarlos. Seguramente se generen buenos grupos para todo!! Saludos y buenos viajes ✈️????????
busco , Venite
sale , Hola ???? Busco Cordoba-Bs As mañana, el domingo 23. Alguien que conduce?
busco , Hola grupo! Por ahora no necesito viaje, estoy buscando paginas como esta o Como carpolear pero de BRASIL ! Si alguien sabe pasa info GRACIAS !
sale , Hola familia! me voy en tren a cordoba pero me quedan unas cositas por llevar que no puedo llevar encima : la bici de mi hijo y una mesita y un banquito para trabajar. Sera que alguien me lo lleva? De Cap, fed, buenos aires a Cosquin, cordoba. Podria acercarlas a cualquier lugar de bs as. gracias! Buen camino para todxs!
sale , Hola!!!! ALGUIEN QUE VIAJE A TRES ARROYOS DESDE TANDIL EL LUNES O MARTES??? NECESITO UN LUGarcin PARA MI. AGRADEZCOOO
sale , Busco guia turistico aficionad@ en Buenos Aires primera semana de mayo ????????
sale , Gente me afanaron en mendoza la plata q tenia para el pasaje de vuelta a neuquen si alguien viaja esta noche a san rafael o neuquen sera retribuido por favor necesito ayuda...
sale , Holaaa como va? Estamos con mi compañero en Misiones sobre la 14 cruce con la 105, por si alguien anda cerca para un tironcito, estamos volviendo a Bs As! Hacemos musica, cebamos mates y buena ondaa, abrazoooo buenas rutas (:
busco , Salgo para cordoba si alguien necesita llevar o traer algo.
sale , #busoviaje desde #sanmartin #zapala #neuquen hasta #santarosa #roca para cualquier dia de ABRIL
sale , Buscamos lugares para viajar de Olavarría a tandil a ver las pastillas el viernes 28.. Somos 4
busco , Hola gente! Buscamos viaje de Rio Gallegos hasta Bariloche.o alrededores. Somos tres. Con mochila lista!!! Desde manana ya estamos alli
busco , Hola gente ! Alguien que pase por Olavarría y vaya a buenos aires el 6 de mayo ?
sale , Sale auto de San Luis pa Mendoza hoy... si a alguien le sirve!
sale , Hola Amigas/os, les comento, necesito viajar a Uruguay, Montevideo. Es el cumple de mi viejo el martes y no le puedo fallar en sus 86 pirulos. No cuento con el efectivo para un pasaje, pero colaborar de seguro con el menu y hasta para hacer terapia entre charla y unos buenos mates. Abrazón pa' la barra!
sale , Alguien q viaje y me pueda llevar para entre rios desde bs as gracias ????
sale , Hola que tal alguien en Amaicha (Argentina) o que sepa de un hostal o camping económico gracias
sale , Salgo esta tarde desde#Córdobatransporteriggar#buenossires.... Es en autopista Rosario Córdoba frente a la shell
sale ,  interminables anecdotas viajeras y flashes de la vida? Desde ya agradecemos de todo corazon!♥️ Buenas rutas!!!
sale , #Lanzarote, lo mejor de las Islas #Canarias. Atardecer en #Famara, la playa de los surferos!!!
busco , hola de misiones puerto rico a corrientes!
sale , Viajo de San Francisco,Córdoba a Neuquén pasando por San Rafael. Dispongo de 2 lugares. Para el día sábado 22.
sale , #sale viaje : lugar para viajar desde San Luis a #BsAs. mañana por la mañana, en principio por ruta 7 hasta Rufino, luego por ruta 8. Contactar con Alberto Pato Soria por in box !!
sale , Hola alguien viaja desde san marcos o cruz del eje a traslasierra?
busco , Buenas... #salgo desde #buenosaires mañana a las 10:00 hasta #cordoba. Y regresó el domingo desde #cordoba hasta #bsas. pasó por #rosario. Buenas rutas
busco , Hola amigos !! Alguien sale para jujuy o Salta ?? Tengo q ir a hacer un trabajo ... Gracias!!!
busco , Sábado 22 , lógico sebamos mates y compartimos gastos :D
sale , Hola alguien viaja a #Tucuman desde #BuenosAires y q pueda llevar a mi hermano, ayer le pegaron un tiro a mis 2 hermanos mayores y uno esta grave. Y estamos sin plata.
sale , Hola !!! Alguien que haga mar del plata-BsAs este viernes 28. Somos dos. Compartimos gastos, sebamos mate. Contamos chistes y demás para tener un lindo viaje
sale , Alguien q pase por mendoza hacia el sur vualquier parte me sirve rio negro o neuquen estog en terribles aprietos... Desde neuquen puedo hacer giros de plata o hago algo de dinero en mendoza x favor necesito volver con urgencia a neuquen mi hijo me espera...
busco , Hola somos dos viernes próximo. ..a tres arroyos si tienen lugarcito. ..gracias! !
sale , HOLA GENTE !! necesito viajar de MAR DEL PLATA a CAPITAL FEDERAL el día JUEVES 27 DE ABRIL, brindo buena compañía y comparto gastos, alguien ?
sale , Buenas gente, como va? Somos 2 personitas que buscan un viajesito de floripa a cualquier frontera con argentina. Toda data suma Km. Tantisima gracia
busco , Hola Gente! Busco alguen qien vas desde puerto iguazu hasta buenos aires mañana :-) Gracias ...
sale , Gente hermosa!!! Estamos con ganas de recorrer el norte de nuestro país, preferentemente Jujuy, en las vacas de invierno, hostel, hospedajes, campings recomendables? Lugares para conocer? Medios de transporte para trasladarse allí? Cualquier info es bienvenida!!! Desde ya, gracias muchassss!!! abrazo enorme :)
busco , Holaaaa buen día! Busco viaje de CABA a MdQ para este sábado bien temprano.... Gracias
sale , POR FAVOR SI ALGUIEN LO VIÓ HACIENDO DEDO...O EN ALGÚN LUGAR DE ARGENTINA...ES DE CORRIENTES LO ESTAMOS BUSCANDO DESDE EL 31 DE MARZO...SE AGRADECE DIFUNDIR!!!
sale , https://www.facebook.com/416756332019315/photos/a.416760625352219.1073741826.416756332019315/416760632018885/?type=3
sale , Hola salimos el miércoles 19 a la mañana desde santa rosa de calamuchita hasta capital federal ! Quedan 2 lugares para compartir gastos !
sale , Sale la nave galactica desde CABA a Mar del Plata el lunes 24/4! Viajamos a la velocidad del paisaje, su viaje sera de 6 horas, caminamos lento mas llevamos casa propia. Compartimos gastos aprox $300/$350, se aceptan valijas grandes y compañeros amistosos del reino animal (los angeles viajan gratis)l, en Pangea viaja un peludo de 13 años... Hago flete de heladeras, lavarropas, lo que necesites, consulta el aporte! Bendiciones a todos! Whatsapp 01161712110
sale , Lençóis Maranhenses, un imperdible de Sudamérica
sale , https://www.facebook.com/416756332019315/photos/a.416760625352219.1073741826.416756332019315/416760632018885/?type=3
busco , Haciendo nos fuertes con la ayuda del bosque.
busco , Nuestra aventura para ir al monte Roraima, toda una odisea venezolana!
busco , Buenas llego el 22 por la tarde a puerto iguazú.. alguno para buenos aires?? 22,23 o 24 ?
sale , hola gentes como andan? espero que bien! Alguien que valla a cordoba los primeros dias de mayo? si van a jesus maria seria genial comparto gastos. Saludos
sale , Gente alguien sale de mendoza a san rafael de ultima besesito llegar urgente a neuquen x favor comparto gasto en lo q me sea posible
sale , -buenos tardes! Quería consultar si hay lugar en un coche de Mar del Plata a CABA en los primeros días de mayo. Gracias.
sale , Hola a todoos!!! Como estan? Chicos busco viajar los primeros dias de mayo a Florianopolis. Desde buenos aires. Alguien que salga para brasil?? ( puede ser uruguay, o lo mas cerca posible de floripa) Comparto gastos :) Graciassss. Abrazooos!!
busco , Buenas !! Busco viaje de buenos aires hasta cordoba, cuando sea. Puedo colaborar con gastos , llevo mates y no me quedo dormida. Mejor imposible jaja
sale , Hola gente. Estoy buscando viaje para hoy o el viernes de olavarria a capital. Comparto gastos. Quien sepa algo, escribame. Gracias!
busco , hola gente linda!!!! alguien va a #buenosaires #capital desde #Sanluis la semana q viene ? lunes o martes ? somos dos compartimos gastos mates y la mejor buena onda! vamos q nos vamos ????????????
sale , Hola gente linda! Como va? Les cuento.. tengo un amigo que busca viaje para este sabado 22 El recorrido es .(.bahia blanca - general acha.). o si lo pueden acercar hasta el cruze de padre buodo .. seria un golazo ! Desde ya muchas gracias :) Pueden contactarse con el por mensaje privado su nombre es Juanjo Garraza ... seba mates y toca la violaa un copaado!!!
sale , Holaaa!! Buscamos viaje de Colón(entre ríos )hacia maldonado o Montevideo..
busco , Buen dia alguien q valla a mar del plata y pase por san clemente la semana que viene?
sale , Buenas... Alguien viaja hoy de Paraná oSanta Fe a Córdoba ?? Ando buscando un aventón...
sale , Holaaaaaaaa sale viaje en un par de horas a #reconquistassantafe desde#zarate... Pasando por #rosario #santafe hasta #reconquista y de ahí a #resistecia #corrientes #virasoro
sale , Hola gente este viernes 7 de abril vamos a salir de #Mendoza rumbo a #Santafe junto a un amigo vamos por ruta 7 haciendo dedo si alguien sale o nos puede tirar unos kilómetros sería de gran ayuda , llevamos mates y ayudamos para la nafta saludos y buenas rutas
sale , si quieren darle el me gusta a mi pagina de viaje sera mas que bienvenido :-) gracias y abrazos!!! https://www.facebook.com/cumbitaviajera/
busco , Perú y su hermosa sierra.
sale , Un hermoso pulmón.
sale , y al fin a llegado mi amigo camionero Carlos Suligoy a casa !!! felices compartiendo con él !!!
busco , Hola alguien d rosario q viaje a alcorta??
sale , Viernes 21 a la mañana salgo de #SantaFe a #BuenosAires #CABA. Tengo 2 lugares
sale , Buenas noches! Gracias por aceptarme! Alguien que Viaje desde Córdoba a San Francisco. El Viaje es por Ruta 19, tengo mate, comparto gastos y llevo poco equipaje ???? !!
busco , #cordoba hacía #capital federal?
busco , Busco viaje, #Cordoba a #BuenosAires o #Rosario para el domingo 23. Somos dos, compartimos gastos! Saludos
sale , Hola genteee buenas buenas!!! Alguien que vaya de #Salta a #BuenosAires? Desde ya muchas gracias
sale , SALE AUTO mañana 7 y media. Desde miramar ...pasa x mar del plata hasta la plata.
sale , Que tal Viajeros hoy quiero compartir con ustedes un articulo donde podran encontrar algunos lugares para aquellos que esten proximamente viajar a colombia por un tiempo o que de igual manera les guste apoyar desinteresadamente a los demás por medio de voluntariados.. Espero que les guste y si este articulo les ha sido de mucha ayuda y si te ha gustado #comparte con todos tus amigos que esten próximos a viajar y que les pueda de ser de mucha ayuda en su viaje.
sale , Muy buenas tarde genteeee. Busco viaje de Bs.As a Bariloche. Tambien podría ser hasta el Bolson, o algo cercanito a Bariloche. Sería para cualquier fecha en Mayo. Desde ya muchas gracias. ????
sale , Sale auto bs.as.-mdq mañana lunes.hay lugares
sale , Las Ventanas del Tisquizoque/ FLORIAN-COLOMBIA. el lugar perfecto para practicar tu pasion por el ciclismo. Uno de los puntos mas importantes de Florian son las cavernas naturales que vierten de su interior una cascada de tres niveles que aumenta la magnitud de su grandeza y está postrada frente al pueblo. En su interior se puede observar un gran salón tallado en piedra por acción del agua de igual manera las estalagmitas hacen parte de este sistema natural. Dentro de esta caverna se esconden los secretos del cacique tisqui, y la cacica zoque, de allí proviene su nombre, “tisquizoque”, caciques descendientes de los chibchas y los Indios Muzos que habitaron esta region colombina.
sale , Quizá no sea el lugar, pero algún voluntariado en Jujuy? Como para ligar unos pesos, de lo que sea, asi sea hasta levantar yuyo !
sale , Buenas gente alguien qe salga de san marcos / capilla / cruz del eje a bs as en estos dias? Somos 3 dos adultos y una nena de 3 años. Gracie
sale , Buen dia... Sabado 6 tendria q estar en cordoba salgo d pehuajo... Podria hacercarme a algún lugar a dedo para encpntrarme con alguien q pueda llevarme... Voy a Jesús María presisamente... Gracias...
sale , Hola!! Busco 2 lugares para el viernes después de las 18 hs de Bs As a Mardel y 2 de vuelta el domingo ???? Llevamos comida y buena onda!
sale , #SALEVIAJE #SANLUIS #DesdeCBA #DOMINGO
sale , Hola se ofrece auto de mar del plata a Bs as el viernes 21/04 después de las 19hs. 3 lugares (equipaje chico) ($300)-------Y de Bs as a mar del plata el domingo 23/04 después de las 19hs 3 lugares (equipaje chico) ($300).....
sale , DESDE LLAVALLOL A JUJUY EN BICICLETA...SOLO..LA IDEA DE MI VIAJE ES LLEVAR ALEGRIA A LOS OLVIDADOS...TAMBIEN AYUDAR A LOS QUE MENOS TIENEN X ESO PENSABA CADA KM RECORRIDO SEA 1 KG DE ALIMENTOS... SUPONGAMOS SALGO DE LLAVALLOL A PILAR...80 KM BUENO LLAMAR ALGUNA RADIO DE ALLA CONVOCAR A LA GENTE Y JUNTAR LOS KG DE ALIMENTOS..Y QUE LOS BOMBEROS LO REPARTAN A QUIEN CREA NESECARIO....EN CASO DE QUE LA GENTE NO SE SUME A ESTA CRUZADA( que puede pasar) A MI REGRESO JUNTAR JUGUETES GOLOSINAS Y HACER UN FESTIVAL PARA LOS CHICOS...Y TAMBIEN JUNTAR ROPITA ESCARPINES ZAPATILLITAS MAMADERAS SACALECHES MANTAS PARA LA GENTE DE PEDIATRIA MATERNIDAD NEONATOLOGIA DEL HOSPITAL GANDULFO....COMO SIEMPRE A PULMON....Si alguien me cruza tomamos mates
sale , Holaaa alto grupo! Alguien tiene pensado viajar a CBA desde BsAs el finde largo del 1 de mayo??? Podria ser dedo tambien, sale lo que sea. La ides es compartir el viaje y disfrutar del mate. Abrazo de sueños viejeros!
busco , Hola !! Somos dos franceses que quieren ir en Mendoza capital viernes desde San Rafel. Puedes ayudarnos ? Gracias ! #mendoza #sanrafael
sale , Alguien sabe como llego lo mas directo posible de villa gral belgrano a mina clavero o nono? Alguien q vaya hoy 19 para alla de alguna zona lindante? Compartimos gastos somos dos con poco equipaje. Desde ya gracias
sale , Hola amigos camioneros buen día! Necesito llevar un Peugeot 206 desde Merlo, San Luis hasta La Banda del Río Salí, Tucumán . Alguien podría facilitarme información? Cómo podría hacer para transportarlo? El seguro no cubre y cobra diferencias irracionales para el transporte. Dejo un celular para comunicarse cualquier cosa! Muchas gracias 011 15 6247 6549 . Estela
sale , Holaa gente! como vaa? :) alguien q vaya para Mar del Plata desde La Plata o BsAs el 2 o 3 d mayo? somos dos pibes, compartimos gastos y buena ondaa
sale , Por favor si algún camionero, alguna persona con camioneta pasa por Santiago de Estero hoy y puede traer a mi pareja y su moto.. se cayo no puede manejar... nos quisieron ayudar usamos la grúa del mes... y todavía esta barado...x favor gracias...
sale , Alguien que tenga una camioneta que este por pasar a Santiago de Estero y venga a Bs As para transladar una moto... no será gratis desde ya será remunerado pero no lo que nos pide el seguro... Desde ya muchas gracias!!!
busco , Hola i search a travel from el chalten to el bolson,or near! This next days.MUcha gracias
busco , VIajeros que NO hablan INGLES y quieren viajar!
